,BasisOfRec,Binomial,CatalogNo,Citation,CollectID,Compiler,Data_sens,Dec_Lat,Dec_Long,Dist_comm,Event_Year,Origin,Presence,Seasonal,Sens_comm,SpatialRef,YrCompiled,recordedBy
1476,PRESERVED_SPECIMEN,Ardisia wedelii,1560028,GBIF,,Manuel Vargas,,9.784167,-84.583333,Sitio Lomas Pizote.,1990.0,1,1,1,,WGS84,2019,Rodolfo Zúñiga
1740,PRESERVED_SPECIMEN,Ardisia wedelii,1564078,GBIF,,Manuel Vargas,,10.416667,-83.56666700000001,"Estacion Agua Fria, a 8 Km al Sureste de la casa-estacion, sobre el Sendero Los Raudales. Vegetacion primaria.",1987.0,1,1,1,,WGS84,2019,Rafael Robles
1885,PRESERVED_SPECIMEN,Ardisia wedelii,1568350,GBIF,,Manuel Vargas,,10.916667,-85.333333,Dos Rios. Area de bosque 1 Km antes de Rio Pizote siguiendo el camino de Dos Rios a Brasilia.,1987.0,1,1,1,,WGS84,2019,Gerardo Herrera
1915,PRESERVED_SPECIMEN,Ardisia wedelii,1569347,GBIF,,Manuel Vargas,,10.783333,-85.259722,Sendero a la Finca Mora. Cercanias de Colonia Blanca.,1990.0,1,1,1,,WGS84,2019,Gerardo Rivera
3137,PRESERVED_SPECIMEN,Ardisia wedelii,1580158,GBIF,,Manuel Vargas,,10.494444,-84.722222,Falda Norte del Volcan Arenal. Camino a Tabacon.,1994.0,1,1,1,,WGS84,2019,Eduardo Lepiz
3166,PRESERVED_SPECIMEN,Ardisia wedelii,1580855,GBIF,,Manuel Vargas,,10.880556,-85.401389,Estacion San Ramon. Dos Rios. 2 Km al N. del Sector.,1993.0,1,1,1,,WGS84,2019,Roberto Espinoza
4445,PRESERVED_SPECIMEN,Ardisia wedelii,2832452,GBIF,,Manuel Vargas,,10.163344,-83.939112,CR Limon PNBC Est Queb Gonsalez,1998.0,1,1,1,,WGS84,2019,Alexánder Francisco Rodríguez González; Luis Diego Vargas
4446,PRESERVED_SPECIMEN,Ardisia wedelii,2832453,GBIF,,Manuel Vargas,,10.163344,-83.939112,CR Limon PNBC Est Queb Gonsalez,1998.0,1,1,1,,WGS84,2019,Alexánder Francisco Rodríguez González; Luis Diego Vargas
5146,PRESERVED_SPECIMEN,Ardisia wedelii,2928595,GBIF,,Manuel Vargas,,10.583333,-83.533333,"Ladera Noroeste, pendientes pronunciadas 4 Km al Norte de Tortuguero, rumbo a la Barra del Colorado. Suelos bien drenados y pedregosos.",1988.0,1,1,1,,WGS84,2019,Rafael Robles
6067,PRESERVED_SPECIMEN,Ardisia wedelii,3361812,GBIF,,Manuel Vargas,,10.907392,-85.276965,Corredor Bosque Lluvioso Rincón - Cacao; 400 m; entre Valle Verde y Buenos aires de Dos Ríos de Upala.,2000.0,1,1,1,,WGS84,2019,Calixto Moraga
6070,PRESERVED_SPECIMEN,Ardisia wedelii,3361813,GBIF,,Manuel Vargas,,10.907392,-85.276965,Corredor Bosque Lluvioso Rincón - Cacao; 400 m; entre Valle Verde y Buenos aires de Dos Ríos de Upala.,2000.0,1,1,1,,WGS84,2019,Calixto Moraga
10564,PRESERVED_SPECIMEN,Ardisia wedelii,4115670,GBIF,,Manuel Vargas,,10.452778,-84.658333,R. B. Arenal Mundo Aventura.,2004.0,1,1,1,,WGS84,2019,Alexánder Francisco Rodríguez González
12826,PRESERVED_SPECIMEN,Ardisia wedelii,4460263,GBIF,,Manuel Vargas,,10.943222,-85.317639,"Alajuela. Upala, Dos Ríos, San Luis. Área de Conservación Guanacaste. Estación Leiva.",2015.0,1,1,1,,WGS84,2019,Nelson A. Zamora Villalobos; Roberto Espinoza ; Enia Navarro ; Braulio Hernández ; Jorge Hernández
12827,PRESERVED_SPECIMEN,Ardisia wedelii,4460262,GBIF,,Manuel Vargas,,10.943222,-85.317639,"Alajuela. Upala, Dos Ríos, San Luis. Área de Conservación Guanacaste. Estación Leiva.",2015.0,1,1,1,,WGS84,2019,Nelson A. Zamora Villalobos; Roberto Espinoza ; Enia Navarro ; Braulio Hernández ; Jorge Hernández
12828,PRESERVED_SPECIMEN,Ardisia wedelii,4460261,GBIF,,Manuel Vargas,,10.943222,-85.317639,"Alajuela. Upala, Dos Ríos, San Luis. Área de Conservación Guanacaste. Estación Leiva.",2015.0,1,1,1,,WGS84,2019,Nelson A. Zamora Villalobos; Roberto Espinoza ; Enia Navarro ; Braulio Hernández ; Jorge Hernández
13896,PRESERVED_SPECIMEN,Ardisia wedelii,,GBIF,,Manuel Vargas,,10.94,-85.32,"Costa Rica:Area de Conservacion Guanacaste, Sector Leiva, Sendero cerca de la casa",2010.0,1,1,1,,WGS84,2019,Adrian Guadamuz
15636,PRESERVED_SPECIMEN,Ardisia wedelii,3042607,GBIF,Coronado González 3380,Manuel Vargas,,14.333329999999998,-85.15,"Municipio de Wiwili, Reserva de Bosawas, comunidad de San Andrés, Río Coco, Caño Uran",2006.0,1,1,1,,WGS84,2019,I. Coronado G.|M. Barrios|G. Pérez|F. Moncada
15733,PRESERVED_SPECIMEN,Ardisia wedelii,3086965,GBIF,Grayum 10928,Manuel Vargas,,9.775,-83.333333,"Cordillera de Talamanca, along divide between Rio Xikiari and Rio Boyei above Cabécar village of Almirante (not on current maps).",1995.0,1,1,1,,WGS84,2019,Michael H. Grayum
16182,PRESERVED_SPECIMEN,Ardisia wedelii,3251867,GBIF,Urbina 3158,Manuel Vargas,,11.129167,-84.3075,"Municipio El Castillo, Comunidad El Padilla, 1 km al SO",2005.0,1,1,1,,WGS84,2019,D. Urbina
16967,PRESERVED_SPECIMEN,Ardisia wedelii,3583406,GBIF,Long 79,Manuel Vargas,,12.16666,-84.31666,El Recreo,1947.0,1,1,1,,WGS84,2019,L.E. Long
17094,PRESERVED_SPECIMEN,Ardisia wedelii,399755,GBIF,Croat 76457,Manuel Vargas,,8.8,-82.22166700000001,"Chiriquí Grande-Fortuna, above waterfall, 1.6 mi N of Continental Divide. [Coordinates on orginal label: 08º45'N, 82º17'W]",1994.0,1,1,1,,WGS84,2019,Thomas B. Croat|Guang Hua Zhu
17114,PRESERVED_SPECIMEN,Ardisia wedelii,400312,GBIF,Grayum 5866,Manuel Vargas,,9.758333,-84.55,"Western part of Montañas Jamaica, ca. 3 km northeast of Bijagual de Turrubares, Carara Reserve.",1985.0,1,1,1,,WGS84,2019,Michael H. Grayum|Richard H. Warner|J. C. French|Pamela J. Sleeper
17123,PRESERVED_SPECIMEN,Ardisia wedelii,400471,GBIF,McPherson 10406,Manuel Vargas,,8.751111,-82.251111,Vicinity of Fortuna Dam. Along road north of lake. Forest.,1987.0,1,1,1,,WGS84,2019,Gordon McPherson
17139,PRESERVED_SPECIMEN,Ardisia wedelii,400819,GBIF,McPherson 8688,Manuel Vargas,,8.778611,-82.193611,Along pipeline road in area of Fortuna Dam.,1986.0,1,1,1,,WGS84,2019,Gordon McPherson
17142,PRESERVED_SPECIMEN,Ardisia wedelii,400857,GBIF,Robles González 2131,Manuel Vargas,,10.58,-83.53,"Cerro Tortuguero Ladera Noroeste, pendientes pronunciadas 4 Km al Norte de Tortuguero, rumbo a la Barra del Colorado. Suelos bien drenados y pedregosos.",1988.0,1,1,1,,WGS84,2019,Rafael Robles
17143,PRESERVED_SPECIMEN,Ardisia wedelii,400846,GBIF,Robles González 1160,Manuel Vargas,,10.41,-83.56,"Parque Tortuguero Estación Agua Fría, a 8 Km al Sureste de la casa-estación, sobre el Sendero Los Raudales. Vegetación primaria.",1987.0,1,1,1,,WGS84,2019,Rafael Robles
17144,PRESERVED_SPECIMEN,Ardisia wedelii,400860,GBIF,Churchill 5497,Manuel Vargas,,8.7,-82.23333000000001,Fortuna Dam area. Unnamed creek to E of road flowing into Río Hornito near Quebrada Moro.,1984.0,1,1,1,,WGS84,2019,H. W. Churchill
17149,PRESERVED_SPECIMEN,Ardisia wedelii,400983,GBIF,McPherson 7158,Manuel Vargas,,8.5,-81.116667,"Cerro Tute, W of Santa Fe, beyond Alto de Piedra.",1985.0,1,1,1,,WGS84,2019,Gordon McPherson
17151,PRESERVED_SPECIMEN,Ardisia wedelii,401065,GBIF,Croat 66549,Manuel Vargas,,8.75,-82.3,Vicinity of Fortuna Dam in valley of Río Chiriquí; along aquaduct trail for water supply for IRHE facilities.,1987.0,1,1,1,,WGS84,2019,Thomas B. Croat
17154,PRESERVED_SPECIMEN,Ardisia wedelii,401119,GBIF,McPherson 9680,Manuel Vargas,,8.778333,-82.192778,"Vicinity of Fortuna Dam. Along pipeline road leaving road to Chiriquí Grande at continental divide, 2.8 road-miles from divide.",1986.0,1,1,1,,WGS84,2019,Gordon McPherson
17188,PRESERVED_SPECIMEN,Ardisia wedelii,403143,GBIF,Moreno 7511,Manuel Vargas,,13.6,-85.65,"Cerro San Pedro, Cerro Kilambé",1981.0,1,1,1,,WGS84,2019,P. P. Moreno|J.C. Sandino
17191,PRESERVED_SPECIMEN,Ardisia wedelii,403267,GBIF,Moreno 7623,Manuel Vargas,,13.616667000000001,-85.666667,"Las alturas de Kilambé, Filas El Portal, noreste de Cerro Kilambé.",1981.0,1,1,1,,WGS84,2019,P. P. Moreno|J.C. Sandino
17193,PRESERVED_SPECIMEN,Ardisia wedelii,403342,GBIF,Sandino 229,Manuel Vargas,,13.583332999999998,-85.65,Cara este del Macizo Kilambé,1980.0,1,1,1,,WGS84,2019,J.C. Sandino
17195,PRESERVED_SPECIMEN,Ardisia wedelii,403397,GBIF,Moreno 7716,Manuel Vargas,,13.566667,-85.666667,"Comarca Santa Cruz El Calvario, al suroeste de Cerro Kilambé",1981.0,1,1,1,,WGS84,2019,P. P. Moreno|J.C. Sandino
18408,PRESERVED_SPECIMEN,Ardisia wedelii,782023,GBIF,Churchill 5929,Manuel Vargas,,8.85,-82.16666,"Road from Fortuna Dam to Chiriquí Grande, 10 mi from Continental Divide. Alt. 400 m. 8º51'N, 82º10'W.",1984.0,1,1,1,,WGS84,2019,H. W. Churchill
22226,PRESERVED_SPECIMEN,Ardisia wedelii,126782,GBIF,,Manuel Vargas,,10.75,-85.05,Remnant evergreen forest and secondary growth the tropical premontane wet forest transition zone about 3 km NNE of Bijagua along new road to Upala,,1,1,1,,WGS84,2019,"Burger, William"
22230,PRESERVED_SPECIMEN,Ardisia wedelii,136862,GBIF,,Manuel Vargas,,10.58,-83.53,"P.N. Tortuguero Cerro Tortuguero, ladera noroeste, pendiente pronunciadas 4 km al Norte de Tortuguero, rumbo a la Barra del Coorado.Suelos bien drenados y prdregosos",1988.0,1,1,1,,WGS84,2019,"Robles, Rafael"
22240,PRESERVED_SPECIMEN,Ardisia wedelii,185465,GBIF,,Manuel Vargas,,9.79,-83.55,Jicotea.Cuenca media del Río Jicotea,1995.0,1,1,1,,WGS84,2019,"Herrera, Gerardo"
22243,PRESERVED_SPECIMEN,Ardisia wedelii,190647,GBIF,,Manuel Vargas,,9.77,-83.54,Jicotea.Altos entre Cuenca del Río Vereh y el Jicotea,1995.0,1,1,1,,WGS84,2019,"Cascante, Alfredo"
22247,PRESERVED_SPECIMEN,Ardisia wedelii,199875,GBIF,,Manuel Vargas,,10.49,-84.72,Cordillera de Tilarán.Falda Norte del Volcán Arenal.Camino a Tabacón,1994.0,1,1,1,,WGS84,2019,"Lépiz, Eduardo"
22251,PRESERVED_SPECIMEN,Ardisia wedelii,205704,GBIF,,Manuel Vargas,,9.29,-83.77,Tinamaste. Finca de los Suizos,1997.0,1,1,1,,WGS84,2019,"Estrada, Armando"
34213,PRESERVED_SPECIMEN,Ardisia wedelii,,GBIF,3211,Manuel Vargas,,8.5714,-79.9106,,1974.0,1,1,1,,WGS84,2019,S. A. Mori & J. A. Kallunki
34215,PRESERVED_SPECIMEN,Ardisia wedelii,,GBIF,79,Manuel Vargas,,13.0,-84.5,,1947.0,1,1,1,,WGS84,2019,L. E. Long
34494,PRESERVED_SPECIMEN,Ardisia wedelii,,GBIF,27652,Manuel Vargas,,8.5714,-79.9106,,1974.0,1,1,1,,WGS84,2019,T. B. Croat
35691,PRESERVED_SPECIMEN,Ardisia wedelii,931780,GBIF,Rueda 1892,Manuel Vargas,,10.76666,-84.06666,"A lo largo del Río San Juan 15 km al Norte del Puesto de MARENA, El Tambor",1994.0,1,1,1,,WGS84,2019,R.M. Rueda|B. Hernández|E. Palma
35733,PRESERVED_SPECIMEN,Ardisia wedelii,945141,GBIF,Rueda 2870,Manuel Vargas,,11.066667,-84.366667,"Municipio El Castillo, Sábalos, comarca Las Maravillas",1995.0,1,1,1,,WGS84,2019,R.M. Rueda|B. Hernández|E. Palma
35738,PRESERVED_SPECIMEN,Ardisia wedelii,946353,GBIF,Rueda 3178,Manuel Vargas,,11.6,-84.033333,Noroeste del poblado de Nueva Atlanta.,1994.0,1,1,1,,WGS84,2019,R.M. Rueda|B. Hernández|I. Coronado G.
36086,PRESERVED_SPECIMEN,Ardisia wedelii,401361,GBIF,McPherson 7390,Manuel Vargas,,8.811389,-82.28,"Along road to Chiriquí Grande. [Coordinates on orginal label: c. 8º45'N, 82º15'W].",1985.0,1,1,1,,WGS84,2019,Gordon McPherson
36089,PRESERVED_SPECIMEN,Ardisia wedelii,401379,GBIF,Sandino 3341,Manuel Vargas,,11.583333,-84.35,"El Escobillo, 2 km de Colonia Serrano, camino a Yolaina; bosque húmedo",1982.0,1,1,1,,WGS84,2019,J.C. Sandino
36110,PRESERVED_SPECIMEN,Ardisia wedelii,401998,GBIF,Hammel 14667,Manuel Vargas,,8.8,-82.216667,"La Fortuna area, ca. 2 miles north of continental divide; along stream and on ridge above first house E of road.",1986.0,1,1,1,,WGS84,2019,Barry E. Hammel|Gordon McPherson|L. Sanders
36123,PRESERVED_SPECIMEN,Ardisia wedelii,402319,GBIF,Herrera Chacón 1093,Manuel Vargas,,10.91,-85.33,"Dos Ríos, Area de bosque 1 Km antes de Río Pizote siguiendo el camino de Dos Ríos a Brasilia",1987.0,1,1,1,,WGS84,2019,Gerardo Herrera Ch.
39137,PRESERVED_SPECIMEN,Ardisia wedelii,100628179,GBIF,Zapata 3164,Manuel Vargas,,8.782778,-82.177222,Bosque Protector Palo Seco.,,1,1,1,,WGS84,2019,Alvin Zapata
39598,PRESERVED_SPECIMEN,Ardisia wedelii,,GBIF,,Manuel Vargas,,10.94,-85.32,"Costa Rica:Area de Conservacion Guanacaste, Sector Leiva, Sendero cerca de la casa",2010.0,1,1,1,,WGS84,2019,Adrian Guadamuz
39612,PRESERVED_SPECIMEN,Ardisia wedelii,,GBIF,,Manuel Vargas,,10.94,-85.32,"Costa Rica:Area de Conservacion Guanacaste, Sector Leiva, Sendero cerca de la casa",2010.0,1,1,1,,WGS84,2019,Adrian Guadamuz
40070,PRESERVED_SPECIMEN,Ardisia wedelii,3149112,GBIF,1160,Manuel Vargas,,10.42,-83.57,"Parque Tortuguero. Estación Agua Fría, a 8 Km al Sureste de la casa-estación, sobre el Sendero Los Raudales.",1987.0,1,1,1,,WGS84,2019,R. Robles
40147,PRESERVED_SPECIMEN,Ardisia wedelii,3149120,GBIF,1093,Manuel Vargas,,10.92,-85.33,Upala. Dos Ríos. Area de bosque 1 Km antes de Río Pizote siguiendo en camino de Dos Ríos a Brasilia.,1987.0,1,1,1,,WGS84,2019,G. Herrera
41774,PRESERVED_SPECIMEN,Ardisia wedelii,2598968,GBIF,Croat 48725,Manuel Vargas,,8.7,-82.23333000000001,"Vicinity of Fortuna Dam site on Río Chiriqui beyond Gualaca 9.4 mi beyond Gate to Francisco Linare's house, 20.9 mi from bridge over Río Estí, 10.8 mi beyond Los Planes de Hornito.",1979.0,1,1,1,,WGS84,2019,Thomas B. Croat
42162,PRESERVED_SPECIMEN,Ardisia wedelii,,GBIF,7650,Manuel Vargas,,8.5714,-79.9106,,1975.0,1,1,1,,WGS84,2019,S. A. Mori & Bolten
43125,MATERIAL_SAMPLE,Ardisia wedelii,BioBot12120,GBIF,,Manuel Vargas,,10.89,-85.38799999999999,"Area de Conservacion Guanacaste, Sector  San Cristobal, San Gerardo, potero en regeneracion la Argentina",2011.0,1,1,1,,WGS84,2019,Adrian Guadamuz
43126,MATERIAL_SAMPLE,Ardisia wedelii,BioBot06685,GBIF,,Manuel Vargas,,10.902000000000001,-85.288,,2011.0,1,1,1,,WGS84,2019,Jorge Hernandez
43137,MATERIAL_SAMPLE,Ardisia wedelii,BioBot12121,GBIF,,Manuel Vargas,,10.89,-85.38799999999999,"Area de Conservacion Guanacaste, Sector  San Cristobal, San Gerardo, potero en regeneracion la Argentina",2011.0,1,1,1,,WGS84,2019,Adrian Guadamuz
43145,MATERIAL_SAMPLE,Ardisia wedelii,BioBot12122,GBIF,,Manuel Vargas,,10.89,-85.38799999999999,"Area de Conservacion Guanacaste, Sector  San Cristobal, San Gerardo, potero en regeneracion la Argentina",2011.0,1,1,1,,WGS84,2019,Adrian Guadamuz
43152,MATERIAL_SAMPLE,Ardisia wedelii,BioBot06703,GBIF,,Manuel Vargas,,10.902000000000001,-85.288,,2011.0,1,1,1,,WGS84,2019,Jorge Hernandez
43253,MATERIAL_SAMPLE,Ardisia wedelii,BioBot11400,GBIF,,Manuel Vargas,,10.943,-85.318,"Area de Conservacion Guanacaste, Sector Leiva, Sendero cerca de la casa",2010.0,1,1,1,,WGS84,2019,Adrian Guadamuz
43259,MATERIAL_SAMPLE,Ardisia wedelii,BioBot11401,GBIF,,Manuel Vargas,,10.943,-85.318,"Area de Conservacion Guanacaste, Sector Leiva, Sendero cerca de la casa",2010.0,1,1,1,,WGS84,2019,Adrian Guadamuz
43260,MATERIAL_SAMPLE,Ardisia wedelii,BioBot11402,GBIF,,Manuel Vargas,,10.943,-85.318,"Area de Conservacion Guanacaste, Sector Leiva, Sendero cerca de la casa",2010.0,1,1,1,,WGS84,2019,Adrian Guadamuz
43455,PRESERVED_SPECIMEN,Ardisia wedelii,4462038,GBIF,,Manuel Vargas,,10.322499,-84.078336,"Heredia. Sarapiquí. P.N. Braulio Carrillo. Cuenca del Sarapiquí. San Ramón de la Virgen de Sarapiquí, Área de Conservación Cordillera Volcánica Central, Estación El Ceibo, Sendero Toma de Agua.",2016.0,1,1,1,,WGS84,2019,Nelson A. Zamora Villalobos; Braulio Hernández
43457,PRESERVED_SPECIMEN,Ardisia wedelii,4462036,GBIF,,Manuel Vargas,,10.322499,-84.078336,"Heredia. Sarapiquí. P.N. Braulio Carrillo. Cuenca del Sarapiquí. San Ramón de la Virgen de Sarapiquí, Área de Conservación Cordillera Volcánica Central, Estación El Ceibo, Sendero Toma de Agua.",2016.0,1,1,1,,WGS84,2019,Nelson A. Zamora Villalobos; Braulio Hernández
43462,PRESERVED_SPECIMEN,Ardisia wedelii,4462037,GBIF,,Manuel Vargas,,10.322499,-84.078336,"Heredia. Sarapiquí. P.N. Braulio Carrillo. Cuenca del Sarapiquí. San Ramón de la Virgen de Sarapiquí, Área de Conservación Cordillera Volcánica Central, Estación El Ceibo, Sendero Toma de Agua.",2016.0,1,1,1,,WGS84,2019,Nelson A. Zamora Villalobos; Braulio Hernández
45176,PRESERVED_SPECIMEN,Ardisia wedelii,122435,GBIF,,Manuel Vargas,,9.775,-83.333333,Cantón de LIMON Cordillera de Talamanca. Along divide between Río Xikiari and Rio  Boyei above Cabécar village of Almirante,1995.0,1,1,1,,WGS84,2019,M. Grayum
47796,PRESERVED_SPECIMEN,Ardisia wedelii,100694325,GBIF,von Wedel 2393,Manuel Vargas,,9.0,-82.233333,"Fish Creek hills, vicinity of Chiriquí Lagoon",1941.0,1,1,1,,WGS84,2019,H. von Wedel
47856,PRESERVED_SPECIMEN,Ardisia wedelii,100722593,GBIF,Rodríguez González 3453,Manuel Vargas,,10.15,-83.9333,"P.N. Braulio Carrillo, Cuenca del Sarapiqui, sendero La Botella",1998.0,1,1,1,,WGS84,2019,Alexánder Rodríguez
47860,PRESERVED_SPECIMEN,Ardisia wedelii,100722582,GBIF,Acosta Vargas 503,Manuel Vargas,,10.05,-84.0166,"P.N. Braulio Carrillo, Cuenca del Sarapiquí, sendero frente a Estación Zurquí",2000.0,1,1,1,,WGS84,2019,Luis Acosta
47917,PRESERVED_SPECIMEN,Ardisia wedelii,100744459,GBIF,Burger 9810,Manuel Vargas,,10.75,-85.05,About 3 km NNE of Bijagua along the new road to Upala,1975.0,1,1,1,,WGS84,2019,William C. Burger
48475,PRESERVED_SPECIMEN,Ardisia wedelii,1178875,GBIF,Rueda 5263,Manuel Vargas,,11.01666,-84.23333000000001,"Reserva Indio-Maíz, Municipio de el Castillo, a 5 km de la cabecera del Río Bartola, en dirección hacia el Cerro el Diablo.",1997.0,1,1,1,,WGS84,2019,R.M. Rueda|I. Coronado G.|O. Aráuz|F. Flores
48476,PRESERVED_SPECIMEN,Ardisia wedelii,1178964,GBIF,Rueda 4928,Manuel Vargas,,11.08333,-83.98333000000001,"Reserva Indio-Maíz, Municipio de San Juan del Norte, cerro Cantagallo.",1996.0,1,1,1,,WGS84,2019,R.M. Rueda|I. Coronado G.|N. Tercero
48484,PRESERVED_SPECIMEN,Ardisia wedelii,1179430,GBIF,Rueda 5326,Manuel Vargas,,11.01666,-84.23333000000001,"Reserva Indio-Maíz, Municipio de el Castillo, a 8 km de la cabecera del Río Bartola, en dirección hacia el Cerro el Diablo.",1997.0,1,1,1,,WGS84,2019,R.M. Rueda|I. Coronado G.|O. Aráuz|F. Flores
48498,PRESERVED_SPECIMEN,Ardisia wedelii,1180082,GBIF,Rueda 5610,Manuel Vargas,,11.016667,-84.2,"Reserva Indio-Maíz, Municipio de el Castillo, Cerro el Diablo.",1997.0,1,1,1,,WGS84,2019,R.M. Rueda|I. Coronado G.|O. Aráuz|F. Flores
48525,PRESERVED_SPECIMEN,Ardisia wedelii,1181980,GBIF,Rueda 6022,Manuel Vargas,,11.15,-84.18333,"Reserva Indio-Maíz, Municipio de el Castillo, a lo largo del Caño Chontaleño.",1997.0,1,1,1,,WGS84,2019,R.M. Rueda|I. Coronado G.|O. Aráuz|F. Flores
48769,PRESERVED_SPECIMEN,Ardisia wedelii,1233833,GBIF,Stevens 4799,Manuel Vargas,,11.6,-84.366667,Ca. 6.3 km S of bridge at Colonia Yolaina and ca. 0.8 km S of ridge of Serranías de Yolaina on road to Colonia Manantiales (Colonia Somoza).,1977.0,1,1,1,,WGS84,2019,W. D. Stevens
48779,PRESERVED_SPECIMEN,Ardisia wedelii,1234910,GBIF,Stevens 5061,Manuel Vargas,,11.716667,-84.3,"Caño Costa Riquita, ca. 1.8 km SW of Colonia Naciones Unidas, above (S of) road between Colonia Nuevo Léon and Colonia Naciones Unidas.",1977.0,1,1,1,,WGS84,2019,W. D. Stevens
49548,PRESERVED_SPECIMEN,Ardisia wedelii,1290344,GBIF,Rueda 7889,Manuel Vargas,,13.983329999999999,-85.31666,"Municipio de Bocay, Reserva Bosawas, falda del Macizo de Wizo.",1998.0,1,1,1,,WGS84,2019,R.M. Rueda|I. Coronado G.
49908,PRESERVED_SPECIMEN,Ardisia wedelii,1329090,GBIF,Rueda 9285,Manuel Vargas,,10.85,-84.166667,"Municipio el Castillo, Reserva Indio-Maiz, Cerro Bolívar.",1998.0,1,1,1,,WGS84,2019,R.M. Rueda|F. Flores|W. Velásquez|O. Caballero
49909,PRESERVED_SPECIMEN,Ardisia wedelii,1329282,GBIF,Rueda 9296,Manuel Vargas,,10.85,-84.166667,"Municipio el Castillo, Reserva Indio-Maiz, Cerro Bolívar.",1998.0,1,1,1,,WGS84,2019,R.M. Rueda|F. Flores|W. Velásquez|O. Caballero
50866,PRESERVED_SPECIMEN,Ardisia wedelii,1471808,GBIF,Croat 27652,Manuel Vargas,,8.550833,-81.171389,"Valley of Río Dos Bocas along road between Escuela Agricola Alto Piedra and Calovebora, 15.6 km northwest of Santa Fé; along trail to Santa Fé, steep forested hill east of river.",1974.0,1,1,1,,WGS84,2019,Thomas B. Croat
50981,PRESERVED_SPECIMEN,Ardisia wedelii,1493709,GBIF,Rueda 12359,Manuel Vargas,,11.13333,-84.35,Municipio del Castillo. Estación Biológica La Lupe.,1999.0,1,1,1,,WGS84,2019,R.M. Rueda|I. Coronado G.|W. Velásquez|F. Flores
50982,PRESERVED_SPECIMEN,Ardisia wedelii,1493827,GBIF,Rueda 12405,Manuel Vargas,,11.13333,-84.35,Municipio del Castillo. Estación Biológica La Lupe.,1999.0,1,1,1,,WGS84,2019,R.M. Rueda|I. Coronado G.|W. Velásquez|F. Flores
51135,PRESERVED_SPECIMEN,Ardisia wedelii,1545135,GBIF,Rueda 15031,Manuel Vargas,,11.116667,-84.366667,"Reserva Indio-Maíz, Municipio del Castillo, Estación experimental La Lupe.",2000.0,1,1,1,,WGS84,2019,R.M. Rueda|W. Velásquez
51147,PRESERVED_SPECIMEN,Ardisia wedelii,1548655,GBIF,Rueda 15502,Manuel Vargas,,13.566667,-85.65,"Reserva Natural Kilambé. Muncipio de Bocay, Comunidad Santa Teresa de Kilambé.",2001.0,1,1,1,,WGS84,2019,R.M. Rueda|L.D. Paguaga|H. Mendoza|A. Rivera|N. Toval|M. Garmendia
51939,PRESERVED_SPECIMEN,Ardisia wedelii,1787325,GBIF,Atwood 6975,Manuel Vargas,,13.883332999999999,-84.4,Vicinity of Rosita; rain forest [Seymour series],1974.0,1,1,1,,WGS84,2019,John T. Atwood
52740,PRESERVED_SPECIMEN,Ardisia wedelii,1951333,GBIF,Antonio 5117,Manuel Vargas,,8.75,-82.233333,"Vicinity of Gualaca, ca. 10.7 miles from Planos de Hornito on the road to the La Fortuna dam site.",1980.0,1,1,1,,WGS84,2019,Thomas M. Antonio
53184,PRESERVED_SPECIMEN,Ardisia wedelii,2031212,GBIF,Hammel 10959,Manuel Vargas,,10.43138,-84.00361,"Finca La Selva, the OTS field station on the Río Puerto Viejo just E of its junction with the Río Sarapiquí.",1981.0,1,1,1,,WGS84,2019,Barry E. Hammel
