,BasisOfRec,Binomial,CatalogNo,Citation,CollectID,Compiler,Data_sens,Dec_Lat,Dec_Long,Dist_comm,Event_Year,Origin,Presence,Seasonal,Sens_comm,SpatialRef,YrCompiled,recordedBy
17106,PRESERVED_SPECIMEN,Ardisia opaca,400079,GBIF,Davidse 29248,Manuel Vargas,,9.25,-82.983333,"Cordillera de Talamanca, Atlantic slope, Kámuk massif, ridge between the Río Tararia and the northeastern most Kámuk páramo.",1984.0,1,1,1,,WGS84,2019,Gerrit Davidse|Gerardo Herrera Ch.
17107,PRESERVED_SPECIMEN,Ardisia opaca,400105,GBIF,Davidse 29394,Manuel Vargas,,9.2,-83.05,"Limón-Puntarenas border; Cordillera de Talamanca, Cerro Kasir, on the continental divide.",1984.0,1,1,1,,WGS84,2019,Gerrit Davidse|Gerardo Herrera Ch.
19520,PRESERVED_SPECIMEN,Ardisia opaca,317328,GBIF,,Manuel Vargas,,2.39716,-77.6878,SI.,,1,1,1,,WGS84,2019,"Lozano C., G."
22172,PRESERVED_SPECIMEN,Ardisia opaca,100422,GBIF,,Manuel Vargas,,9.95,-82.81,"Cord. Talamanca, area between headwaters of Río Bella Vista and Sitio Cotón",1983.0,1,1,1,,WGS84,2019,"Davidse, Gerrit"
52090,PRESERVED_SPECIMEN,Ardisia opaca,1811823,GBIF,Gentry 14080,Manuel Vargas,,8.15,-77.31666700000001,"Cerro Tacarcuna Expedition. Vicinity of Cerro Tacarcuna summit camp, along stream N of camp.",1975.0,1,1,1,,WGS84,2019,Alwyn H. Gentry|Scott A. Mori
