,BasisOfRec,Binomial,CatalogNo,Citation,CollectID,Compiler,Data_sens,Dec_Lat,Dec_Long,Dist_comm,Event_Year,Origin,Presence,Seasonal,Sens_comm,SpatialRef,YrCompiled,recordedBy
15892,PRESERVED_SPECIMEN,Ardisia maxonii,3155154,GBIF,Morales Quirós 7174,Manuel Vargas,,9.594439999999999,-83.89027,R.F. Los Santos. Cuenca del Savegre. R.F. Los Santos. Alto Cañazo entre Providencia y Copey.,1999.0,1,1,1,,WGS84,2019,J. F. Morales
17161,PRESERVED_SPECIMEN,Ardisia maxonii,401226,GBIF,Herrera Chacón 3638,Manuel Vargas,,9.369444999999999,-83.3,"Ujarrás, siguiendo la línea divisoria, base del macizo Dúrika, cabecera de Río Coén.",1989.0,1,1,1,,WGS84,2019,Gerardo Herrera Ch.|J. Cordero
17183,PRESERVED_SPECIMEN,Ardisia maxonii,403037,GBIF,Stein 1267,Manuel Vargas,,8.833333,-82.5,"Volcán Baru, east slope on road from Boquete. 8 km W of Boquete (air distance). Oak woodland. Elev. 1900 m. 82º30'W, 8º50'N.",1983.0,1,1,1,,WGS84,2019,Bruce A. Stein
34172,PRESERVED_SPECIMEN,Ardisia maxonii,,GBIF,18341,Manuel Vargas,,9.6667,-84.0,,1999.0,1,1,1,,WGS84,2019,A. Molina R.
34273,PRESERVED_SPECIMEN,Ardisia maxonii,,GBIF,10151,Manuel Vargas,,8.5714,-79.9106,,1975.0,1,1,1,,WGS84,2019,G. Davidse & J. D'Arcy
35511,PRESERVED_SPECIMEN,Ardisia maxonii,905569,GBIF,Herrera Chacón 6157,Manuel Vargas,,9.39,-83.16,P.N. Cordillera de Talamanca; Cordillera de Talamanca. Flanco NE y cumbre Cerro Biricuacua. Entre Ujarrás y San José Cabécar.,1993.0,1,1,1,,WGS84,2019,Gerardo Herrera Ch.
35928,PRESERVED_SPECIMEN,Ardisia maxonii,982431,GBIF,Morales Quirós 4249,Manuel Vargas,,9.70027,-84.18305,"Fila Aguabuena. Hda. Tiquires. Bosque primario, robledales y potreros en la Fila Aguabuena cerca de la Laguna.",1995.0,1,1,1,,WGS84,2019,J. F. Morales
36108,PRESERVED_SPECIMEN,Ardisia maxonii,401969,GBIF,Hamilton 3843,Manuel Vargas,,8.866660000000001,-82.58333,"Hill E of Audubon Cabin, S of Cerro Punta",1983.0,1,1,1,,WGS84,2019,Clem W. Hamilton|Karen Krager
40100,PRESERVED_SPECIMEN,Ardisia maxonii,3640917,GBIF,3638,Manuel Vargas,,9.3694,-83.3,"Cantón de Buenos Aires Ujarrás, siguiendo la línea divisoria, base del macizo Dúrika, cabecera de Río Coén.",1989.0,1,1,1,,WGS84,2019,G. Herrera & J. Cordero
41495,PRESERVED_SPECIMEN,Ardisia maxonii,2507436,GBIF,Knapp 5605,Manuel Vargas,,8.793611,-82.905833,Windswept ridge 10 km N of Los Planes de Hornito. IRHE Fortuna Hydroelectric Project.,1982.0,1,1,1,,WGS84,2019,Sandy Knapp|M.R. Vodicka
42080,PRESERVED_SPECIMEN,Ardisia maxonii,,GBIF,10299,Manuel Vargas,,8.5714,-79.9106,,1975.0,1,1,1,,WGS84,2019,G. Davidse & J. D'Arcy
42136,PRESERVED_SPECIMEN,Ardisia maxonii,,GBIF,13628,Manuel Vargas,,9.6667,-84.0,,1979.0,1,1,1,,WGS84,2019,W. D. Stevens
42187,PRESERVED_SPECIMEN,Ardisia maxonii,,GBIF,3730,Manuel Vargas,,8.5714,-79.9106,,1974.0,1,1,1,,WGS84,2019,S. A. Mori & et al.
47770,PRESERVED_SPECIMEN,Ardisia maxonii,100685222,GBIF,Navarro Valverde 287,Manuel Vargas,,8.933333,-82.801389,"Zona Protectora Las Tablas, Cordillera de Talamanca, Estación Biológica Las Alturas",1996.0,1,1,1,,WGS84,2019,Enia Navarro V.
47845,PRESERVED_SPECIMEN,Ardisia maxonii,100722169,GBIF,Aguilar Fernández 3874,Manuel Vargas,,9.5333,-83.5833,"Parque Internaciónal La Amistad, Cordillera de Talamanca, Sobre el sendero Herradura-Uran",1995.0,1,1,1,,WGS84,2019,Reinaldo Aguilar
47846,PRESERVED_SPECIMEN,Ardisia maxonii,100722168,GBIF,Aguilar Fernández 3962,Manuel Vargas,,9.5333,-83.5833,"Parque Internaciónal La Amistad, Cordillera de Talamanca, Sobre el sendero Herradura-Uran",1995.0,1,1,1,,WGS84,2019,Reinaldo Aguilar
47847,PRESERVED_SPECIMEN,Ardisia maxonii,100722170,GBIF,Aguilar Fernández 3923,Manuel Vargas,,9.5167,-83.5833,"Parque Internaciónal La Amistad, Cordillera de Talamanca, Sobre Herradura, que sube a fila Uran",1995.0,1,1,1,,WGS84,2019,Reinaldo Aguilar
50997,PRESERVED_SPECIMEN,Ardisia maxonii,1497071,GBIF,Stevens 18246,Manuel Vargas,,8.833333,-82.533333,Ca. 3.7 km E of bridge NE of Cerro Punta on road through Bajo Grande.,1980.0,1,1,1,,WGS84,2019,W. D. Stevens
51942,PRESERVED_SPECIMEN,Ardisia maxonii,1787769,GBIF,Davidse 10151,Manuel Vargas,,8.78916,-82.49472,"Eastern slope of Volcán de Chiriquí (Barú), WNW of Boquete. Partially cleared slopes with patches of original oak forest and mostly secondary growth",1975.0,1,1,1,,WGS84,2019,Gerrit Davidse|William G. D'Arcy
51952,PRESERVED_SPECIMEN,Ardisia maxonii,1789934,GBIF,Davidse 10299,Manuel Vargas,,8.797222,-82.49,Ca. 9 km by road WNW of Boquete.,1975.0,1,1,1,,WGS84,2019,Gerrit Davidse|William G. D'Arcy
52732,PRESERVED_SPECIMEN,Ardisia maxonii,1946824,GBIF,Antonio 2865,Manuel Vargas,,8.63333,-82.2,"Vicinity of Los Planes de Hornito, beyond Gualaca, 2-3 km E of Finca Linare High hills, ca. 1400-1900 m.",1979.0,1,1,1,,WGS84,2019,Thomas M. Antonio
