,BasisOfRec,Binomial,CatalogNo,Citation,CollectID,Compiler,Data_sens,Dec_Lat,Dec_Long,Dist_comm,Event_Year,Origin,Presence,Seasonal,Sens_comm,SpatialRef,YrCompiled,recordedBy
45435,PRESERVED_SPECIMEN,Crossopetalum parviflorum,NO DISPONIBLE,GBIF,,Manuel Vargas,,16.941389,-92.13833299999999,Southwest of Palenque on road to Ocosingo along the Jol Uk'um,1981.0,1,1,1,,WGS84,2019,Breedlove
45436,PRESERVED_SPECIMEN,Crossopetalum parviflorum,NO DISPONIBLE,GBIF,,Manuel Vargas,,16.943889000000002,-93.375,18-20 km North of Ocozocoautla along road Mal Paso,1971.0,1,1,1,,WGS84,2019,Breedlove; Thorne
45437,PRESERVED_SPECIMEN,Crossopetalum parviflorum,NO DISPONIBLE,GBIF,,Manuel Vargas,,16.112778,-91.43333299999999,Confluence of the Ixcán with the Río Lacantum on the Guatemala border,1973.0,1,1,1,,WGS84,2019,Breedlove; E. M. McClintock
45438,PRESERVED_SPECIMEN,Crossopetalum parviflorum,NO DISPONIBLE,GBIF,,Manuel Vargas,,17.258889,-94.585833,2 km camino Plan de Arroyo-Río Alegre,1974.0,1,1,1,,WGS84,2019,J. Dorantes
45439,PRESERVED_SPECIMEN,Crossopetalum parviflorum,NO DISPONIBLE,GBIF,,Manuel Vargas,,17.258889,-94.585833,2 km camino Plan de Arroyo-Río Alegre,1974.0,1,1,1,,WGS84,2019,J. Dorantes; et al.
45440,PRESERVED_SPECIMEN,Crossopetalum parviflorum,NO DISPONIBLE,GBIF,,Manuel Vargas,,16.166944,-91.40527800000001,40-42 km east of Lagos de Montebello Natioanl Park,1982.0,1,1,1,,WGS84,2019,Breedlove; F. Almeda
45441,PRESERVED_SPECIMEN,Crossopetalum parviflorum,NO DISPONIBLE,GBIF,,Manuel Vargas,,16.686944,-93.597222,30 km northwest of Ocozocoautla,1972.0,1,1,1,,WGS84,2019,Breedlove
45442,PRESERVED_SPECIMEN,Crossopetalum parviflorum,NO DISPONIBLE,GBIF,,Manuel Vargas,,19.393333,-96.814444,Faldas del Cerro de Achichuca entre Tuzamapan y Jalcomulco,1979.0,1,1,1,,WGS84,2019,Cast.-Campos; et al.
45443,PRESERVED_SPECIMEN,Crossopetalum parviflorum,NO DISPONIBLE,GBIF,,Manuel Vargas,,17.228333,-92.339167,"Bawitz, Yajalón",1982.0,1,1,1,,WGS84,2019,Alonso Méndez Ton
45444,PRESERVED_SPECIMEN,Crossopetalum parviflorum,NO DISPONIBLE,GBIF,,Manuel Vargas,,17.980556,-93.563889,"Campo del Colegio Superior de Agricultura Tropical, km 21 carretera Cárdenas-Coatzacoalcos",1984.0,1,1,1,,WGS84,2019,M. A. Magaña A.
45445,PRESERVED_SPECIMEN,Crossopetalum parviflorum,NO DISPONIBLE,GBIF,,Manuel Vargas,,16.913332999999998,-93.2675,13 km north of Berriozábal near Pozo Turipache and Finca El Suspiro,1973.0,1,1,1,,WGS84,2019,Breedlove
45446,PRESERVED_SPECIMEN,Crossopetalum parviflorum,NO DISPONIBLE,GBIF,,Manuel Vargas,,20.735556,-98.658611,1.7 km al NE de la desviación a Tianguistengo,1983.0,1,1,1,,WGS84,2019,R. Torres C.
45447,PRESERVED_SPECIMEN,Crossopetalum parviflorum,NO DISPONIBLE,GBIF,,Manuel Vargas,,16.789444,-93.366389,3 km north of Ocozocoautla along road to Mal Paso,1971.0,1,1,1,,WGS84,2019,Breedlove; A. R. Smith
45448,PRESERVED_SPECIMEN,Crossopetalum parviflorum,NO DISPONIBLE,GBIF,,Manuel Vargas,,17.2525,-94.668056,Campamento Hermanos Cedillo a 6 km al oeste camino a Paso del Moral,1975.0,1,1,1,,WGS84,2019,M. Avendaño D.; A. Juan
45449,PRESERVED_SPECIMEN,Crossopetalum parviflorum,NO DISPONIBLE,GBIF,,Manuel Vargas,,17.980556,-93.563889,"Campo del Colegio Superior de Agricultura Tropical, km 21 carretera Cárdenas-Coatzacoalcos",1979.0,1,1,1,,WGS84,2019,C. P. Cowan
45450,PRESERVED_SPECIMEN,Crossopetalum parviflorum,NO DISPONIBLE,GBIF,,Manuel Vargas,,16.148332999999997,-88.825556,"Toledo, Trail to Esperanza, beginning 1 mile north of Columbia Forest Estation",1973.0,1,1,1,,WGS84,2019,J. D. Dwyer
45451,PRESERVED_SPECIMEN,Crossopetalum parviflorum,NO DISPONIBLE,GBIF,,Manuel Vargas,,18.573056,-95.257778,"Estación de Biología Tropical Los Tuxtlas, lote 67",1970.0,1,1,1,,WGS84,2019,G. Martínez Calderón
45452,PRESERVED_SPECIMEN,Crossopetalum parviflorum,NO DISPONIBLE,GBIF,,Manuel Vargas,,20.457778,-97.360556,4 km al W de Papantla,1983.0,1,1,1,,WGS84,2019,R. Fernández
45453,PRESERVED_SPECIMEN,Crossopetalum parviflorum,NO DISPONIBLE,GBIF,,Manuel Vargas,,17.5125,-91.99972199999999,"6-12 km South of Palenque on the road to Ocosingo, mpio. de Palenque",1981.0,1,1,1,,WGS84,2019,Breedlove; Davidse
45454,PRESERVED_SPECIMEN,Crossopetalum parviflorum,NO DISPONIBLE,GBIF,,Manuel Vargas,,16.913332999999998,-93.2675,13 km north of Berriozábal near Pozo Turipache and Finca El Suspiro,1973.0,1,1,1,,WGS84,2019,Breedlove
45455,PRESERVED_SPECIMEN,Crossopetalum parviflorum,NO DISPONIBLE,GBIF,,Manuel Vargas,,17.155278,-92.278056,3 km north of Bajachon-Ocosingo road at Temo on road to Palenque,1981.0,1,1,1,,WGS84,2019,Breedlove
45456,PRESERVED_SPECIMEN,Crossopetalum parviflorum,NO DISPONIBLE,GBIF,,Manuel Vargas,,17.365,-91.119722,Cerro de Punta de Montaña,1987.0,1,1,1,,WGS84,2019,M. A. Magaña A.; et al.
45457,PRESERVED_SPECIMEN,Crossopetalum parviflorum,NO DISPONIBLE,GBIF,,Manuel Vargas,,18.110556,-96.14944399999999,"Chiltepec, Tuxtepec",1965.0,1,1,1,,WGS84,2019,Francisco Ramos Marchena
45458,PRESERVED_SPECIMEN,Crossopetalum parviflorum,NO DISPONIBLE,GBIF,,Manuel Vargas,,17.251389,-94.603611,Brecha Hermanos Cedillo-Agustín Melgar,1974.0,1,1,1,,WGS84,2019,Brigada Vázquez
45459,PRESERVED_SPECIMEN,Crossopetalum parviflorum,NO DISPONIBLE,GBIF,,Manuel Vargas,,16.586667000000002,-93.392222,"Cerro Brujo, 20 km al S de Ocozocoautla",1972.0,1,1,1,,WGS84,2019,Breedlove
45489,PRESERVED_SPECIMEN,Crossopetalum parviflorum,K417360,GBIF,,Manuel Vargas,,18.585,-95.07,"Cerca de la Finca de Ramón, Estación de Biología Tropical Los Tuxtlas",1983.0,1,1,1,,WGS84,2019,T.P. Ramamoorthy
45490,PRESERVED_SPECIMEN,Crossopetalum parviflorum,P7591,GBIF,,Manuel Vargas,,16.686667,-91.105,1.5 km al N de Lacanjá Chansayab,1989.0,1,1,1,,WGS84,2019,M. González-Espinosa; P.F. Quintana-Ascencio; M. Martínez-Icó; N. Ramírez-Marcial
45491,PRESERVED_SPECIMEN,Crossopetalum parviflorum,22026,GBIF,,Manuel Vargas,,18.559722,-95.064444,"Estación de Biología Tropical Los Tuxtlas, Jardín Botánico",1984.0,1,1,1,,WGS84,2019,R. Cedillo T.
45492,PRESERVED_SPECIMEN,Crossopetalum parviflorum,22014,GBIF,,Manuel Vargas,,18.584722,-95.07388900000001,"Camino a Cerro Lázaro Cárdenas, Estación de Biología Tropical Los Tuxtlas",1986.0,1,1,1,,WGS84,2019,S. Sinaca C.; F. Chigo S
45493,PRESERVED_SPECIMEN,Crossopetalum parviflorum,22027,GBIF,,Manuel Vargas,,18.59,-95.079722,"Laguna Escondida, 3.5 km al NW de la Estación de Biología Tropical Los Tuxtlas",1985.0,1,1,1,,WGS84,2019,S. Sinaca C.; E. Aparicio
45494,PRESERVED_SPECIMEN,Crossopetalum parviflorum,22025,GBIF,,Manuel Vargas,,18.589167,-95.08805600000001,"Laguna Zacatal, 4.5 km al NW de la Estación de Biología Tropical Los Tuxtlas",1984.0,1,1,1,,WGS84,2019,G. Ibarra M.; N. Pérez N.; A. Valiente B.
45495,PRESERVED_SPECIMEN,Crossopetalum parviflorum,V046558,GBIF,,Manuel Vargas,,18.583610999999998,-95.066389,"Laguna Zacatal, al W, Estación de Biología Tropical Los Tuxtlas",1972.0,1,1,1,,WGS84,2019,A. Villegas H.
45496,PRESERVED_SPECIMEN,Crossopetalum parviflorum,22017,GBIF,,Manuel Vargas,,18.584722,-95.07388900000001,Estación de Biología Tropical Los Tuxtlas,1983.0,1,1,1,,WGS84,2019,G. Ibarra M.
45497,PRESERVED_SPECIMEN,Crossopetalum parviflorum,V041638,GBIF,,Manuel Vargas,,18.584722,-95.07388900000001,Estación de Biología Tropical Los Tuxtlas,1972.0,1,1,1,,WGS84,2019,R. Cedillo T.; J.I. Calzada
45498,PRESERVED_SPECIMEN,Crossopetalum parviflorum,M000037,GBIF,,Manuel Vargas,,17.015556,-91.253889,"Viejo poblado de Alfredo V. Bonfil, alrededores, Selva Lacandona",1976.0,1,1,1,,WGS84,2019,P.E. Valdivia Q.
45499,PRESERVED_SPECIMEN,Crossopetalum parviflorum,22016,GBIF,,Manuel Vargas,,18.584722,-95.07388900000001,"Estación de Biología Tropical Los Tuxtlas, Lote 69",1985.0,1,1,1,,WGS84,2019,S. Sinaca C.
45500,PRESERVED_SPECIMEN,Crossopetalum parviflorum,22015,GBIF,,Manuel Vargas,,18.588611,-95.076389,"Laguna Escondida, 2.5 km al NW de la Estación de Biología Tropical Los Tuxtlas",1986.0,1,1,1,,WGS84,2019,S. Sinaca C.
45501,PRESERVED_SPECIMEN,Crossopetalum parviflorum,P1323,GBIF,,Manuel Vargas,,17.925556,-96.103889,"La Joya del Obispo, predio en el Rancho El Tochero, 10 km al E de San Agustín, Distrito Tuxtepec",1990.0,1,1,1,,WGS84,2019,C.H. Ramos; E. Martínez S.
45502,PRESERVED_SPECIMEN,Crossopetalum parviflorum,V041687,GBIF,,Manuel Vargas,,18.584722,-95.07388900000001,Estación de Biología Tropical Los Tuxtlas,1972.0,1,1,1,,WGS84,2019,R. Cedillo T.
45682,PRESERVED_SPECIMEN,Crossopetalum parviflorum,P29442,GBIF,,Manuel Vargas,,20.725,-98.625,5 km al W de Tianguistengo,1981.0,1,1,1,,WGS84,2019,R. Hernández M.
45893,PRESERVED_SPECIMEN,Crossopetalum parviflorum,V048336,GBIF,,Manuel Vargas,,17.249167,-94.587222,"3 km del Campamento Hermanos Cedillo, camino a Agustín Melgar",1975.0,1,1,1,,WGS84,2019,B. Ortiz S.; M. Avendaño D.
45894,PRESERVED_SPECIMEN,Crossopetalum parviflorum,V094851,GBIF,,Manuel Vargas,,18.584722,-95.07388900000001,Estación de Biología Tropical Los Tuxtlas,1984.0,1,1,1,,WGS84,2019,G. Ibarra M.
45895,PRESERVED_SPECIMEN,Crossopetalum parviflorum,V095314,GBIF,,Manuel Vargas,,18.589167,-95.08805600000001,"Laguna Zacatal, 4.5 km al NW de la Estación de Biología Tropical Los Tuxtlas",1984.0,1,1,1,,WGS84,2019,G. Ibarra M.; N. Pérez N.; A. Valiente B.
45896,PRESERVED_SPECIMEN,Crossopetalum parviflorum,V014647,GBIF,,Manuel Vargas,,18.458333,-95.025,Lago de Catemaco-Coyame,1969.0,1,1,1,,WGS84,2019,A. Gómez-Pompa; L.I. Nevling
45897,PRESERVED_SPECIMEN,Crossopetalum parviflorum,V095796,GBIF,,Manuel Vargas,,18.584722,-95.07388900000001,Estación de Biología Tropical Los Tuxtlas,1981.0,1,1,1,,WGS84,2019,D.H. Lorence; T.P. Ramamoorthy
46213,PRESERVED_SPECIMEN,Crossopetalum parviflorum,V050193,GBIF,,Manuel Vargas,,19.423333,-96.79333299999999,Cerro de Chavarrillo,1979.0,1,1,1,,WGS84,2019,G. Castillo-Campos; L. Tapia M.
46214,PRESERVED_SPECIMEN,Crossopetalum parviflorum,V050176,GBIF,,Manuel Vargas,,19.416667,-96.8,Barranca de Cantera,1979.0,1,1,1,,WGS84,2019,G. Castillo-Campos; L. Tapia M.
46215,PRESERVED_SPECIMEN,Crossopetalum parviflorum,V057561,GBIF,,Manuel Vargas,,18.584722,-95.07388900000001,Estación de Biología Tropical Los Tuxtlas,1970.0,1,1,1,,WGS84,2019,Gpe. Martínez C.
46216,PRESERVED_SPECIMEN,Crossopetalum parviflorum,V040527,GBIF,,Manuel Vargas,,17.258333,-94.591667,"13 km al E del Campamento Hermanos Cedillo, camino a La Laguna",1974.0,1,1,1,,WGS84,2019,J. Dorantes L.
46217,PRESERVED_SPECIMEN,Crossopetalum parviflorum,V044753,GBIF,,Manuel Vargas,,17.2525,-94.612778,"Entre Campamento Hermanos Cedillo y La Escuadra, Río Solosúchil",1974.0,1,1,1,,WGS84,2019,M. Vázquez T.
46218,PRESERVED_SPECIMEN,Crossopetalum parviflorum,P10216,GBIF,,Manuel Vargas,,18.205833,-94.125556,Cuauhtemoctzin,1985.0,1,1,1,,WGS84,2019,S. Zamudio R.
46219,PRESERVED_SPECIMEN,Crossopetalum parviflorum,P4698,GBIF,,Manuel Vargas,,16.125,-90.925,"Estación Biológica Chajúl, 6 km al SW",1993.0,1,1,1,,WGS84,2019,G. Domínguez Vázquez
46220,PRESERVED_SPECIMEN,Crossopetalum parviflorum,V044306,GBIF,,Manuel Vargas,,17.291667,-94.508333,1-6 km carretera Campamento Hermanos Cedillo-La Laguna,1974.0,1,1,1,,WGS84,2019,J. Dorantes L.
46221,PRESERVED_SPECIMEN,Crossopetalum parviflorum,V041283,GBIF,,Manuel Vargas,,17.251667,-94.59916700000001,Campamento Hermanos Cedillo-Agustín Melgar,1974.0,1,1,1,,WGS84,2019,M. Vázquez T.
46222,PRESERVED_SPECIMEN,Crossopetalum parviflorum,22130,GBIF,,Manuel Vargas,,18.584722,-95.07388900000001,"Camino a Laguna Escondida, Estación Biológica Tropical de Los Tuxtlas",1971.0,1,1,1,,WGS84,2019,J.I. Calzada
46223,PRESERVED_SPECIMEN,Crossopetalum parviflorum,22140,GBIF,,Manuel Vargas,,18.584722,-95.07388900000001,Estación de Biología Tropical Los Tuxtlas,1974.0,1,1,1,,WGS84,2019,J.I. Calzada
46224,PRESERVED_SPECIMEN,Crossopetalum parviflorum,22184,GBIF,,Manuel Vargas,,17.860278,-96.209722,"Rancho El Tochero, predio La Joya del Obispo, 10 km al E de San Agustín, Distrito Tuxtepec",1990.0,1,1,1,,WGS84,2019,C.H. Ramos; E. Martínez S.
46225,PRESERVED_SPECIMEN,Crossopetalum parviflorum,V096491,GBIF,,Manuel Vargas,,22.075,-98.008333,"Ejido Gonzalez Ortega, Cerro Topila",1986.0,1,1,1,,WGS84,2019,C. Gutiérrez B.
46226,PRESERVED_SPECIMEN,Crossopetalum parviflorum,22139,GBIF,,Manuel Vargas,,18.584722,-95.07388900000001,Estación de Biología Tropical Los Tuxtlas,1974.0,1,1,1,,WGS84,2019,J.I. Calzada
46227,PRESERVED_SPECIMEN,Crossopetalum parviflorum,22133,GBIF,,Manuel Vargas,,18.584722,-95.07388900000001,Estación de Biología Tropical Los Tuxtlas,1974.0,1,1,1,,WGS84,2019,J.I. Calzada
46228,PRESERVED_SPECIMEN,Crossopetalum parviflorum,V040940,GBIF,,Manuel Vargas,,17.258333,-94.675,"Plan de Arroyo, 4-5 km al S, camino a Alvaro Obregón",1974.0,1,1,1,,WGS84,2019,J. Dorantes L.
46229,PRESERVED_SPECIMEN,Crossopetalum parviflorum,K409150,GBIF,,Manuel Vargas,,18.585,-95.07,"Estación de Biología Tropical Los Tuxtlas, 400 m al SE de la Estación",1992.0,1,1,1,,WGS84,2019,S. Sinaca C.
46230,PRESERVED_SPECIMEN,Crossopetalum parviflorum,V044305,GBIF,,Manuel Vargas,,17.258333,-94.675,2 km carretera Plan de Arroyo-Río Alegre,1974.0,1,1,1,,WGS84,2019,J. Dorantes L.
46231,PRESERVED_SPECIMEN,Crossopetalum parviflorum,Y011825,GBIF,,Manuel Vargas,,20.102222,-89.46,Xul,1983.0,1,1,1,,WGS84,2019,F. May
46232,PRESERVED_SPECIMEN,Crossopetalum parviflorum,22183,GBIF,,Manuel Vargas,,17.25,-91.866667,4 km carretera Chocoljaíto-Bonampak,1966.0,1,1,1,,WGS84,2019,L. González; P. Hernández G.
46233,PRESERVED_SPECIMEN,Crossopetalum parviflorum,22181,GBIF,,Manuel Vargas,,18.520556,-88.408333,"El Palmar, 7 km al S de Ucum, carretera Chetumal-La Unión",1982.0,1,1,1,,WGS84,2019,E. Cabrera C.; H. de Cabrera
46234,PRESERVED_SPECIMEN,Crossopetalum parviflorum,22185,GBIF,,Manuel Vargas,,17.389167,-92.018056,"Mizol-Ha, 40 km al S de Palenque, carretera Catazaja-Ocosingo",1986.0,1,1,1,,WGS84,2019,E. Cabrera C.; H. de Cabrera
46235,PRESERVED_SPECIMEN,Crossopetalum parviflorum,V071630,GBIF,,Manuel Vargas,,18.566944,-95.107222,"Estación de Biología Tropical Los Tuxtlas, Cerro El Vigía",1971.0,1,1,1,,WGS84,2019,J.S. Flores G.
46236,PRESERVED_SPECIMEN,Crossopetalum parviflorum,V044752,GBIF,,Manuel Vargas,,17.2525,-94.612778,"Entre Campamento Hermanos Cedillo y La Escuadra, Río Solosúchil",1974.0,1,1,1,,WGS84,2019,M. Vázquez T.
46237,PRESERVED_SPECIMEN,Crossopetalum parviflorum,V040941,GBIF,,Manuel Vargas,,17.258333,-94.675,"Campamento Hermanos Cedillo, 18 km al NE, camino a La Laguna",1974.0,1,1,1,,WGS84,2019,F. Ponce C.
46238,PRESERVED_SPECIMEN,Crossopetalum parviflorum,22136,GBIF,,Manuel Vargas,,19.791667,-87.608333,5.5 km carretera Vigía Chico-Felipe Carrillo Puerto,1986.0,1,1,1,,WGS84,2019,Rogel Villanueva G.
46239,PRESERVED_SPECIMEN,Crossopetalum parviflorum,V050192,GBIF,,Manuel Vargas,,19.375,-96.805,"Cerro de Achichuca, entrre Tuzamapan-Jalcomulco",1979.0,1,1,1,,WGS84,2019,G. Castillo-Campos; L. Tapia M.
46240,PRESERVED_SPECIMEN,Crossopetalum parviflorum,22182,GBIF,,Manuel Vargas,,20.658333,-88.158333,"Camino a Yalcon, 4 km al S de Valladolid",1985.0,1,1,1,,WGS84,2019,E. Cabrera C.; H. de Cabrera
46241,PRESERVED_SPECIMEN,Crossopetalum parviflorum,V091563,GBIF,,Manuel Vargas,,18.675,-96.675,NO DISPONIBLE,1986.0,1,1,1,,WGS84,2019,R. Robles G.
46242,PRESERVED_SPECIMEN,Crossopetalum parviflorum,22134,GBIF,,Manuel Vargas,,18.584722,-95.07388900000001,Estación de Biología Tropical Los Tuxtlas,1970.0,1,1,1,,WGS84,2019,F. Chiang C.
46243,PRESERVED_SPECIMEN,Crossopetalum parviflorum,V048335,GBIF,,Manuel Vargas,,17.236110999999998,-94.601389,"3 km del Campamento Hermanos Cedillo, camino a Pancho Villa",1975.0,1,1,1,,WGS84,2019,B. Ortiz S.; M. Avendaño D.
46244,PRESERVED_SPECIMEN,Crossopetalum parviflorum,22131,GBIF,,Manuel Vargas,,18.391667,-94.958333,"8 km al E de Tebanca, camino a El Bastonal",1973.0,1,1,1,,WGS84,2019,R. Cedillo T.; J.I. Calzada
46245,PRESERVED_SPECIMEN,Crossopetalum parviflorum,22132,GBIF,,Manuel Vargas,,18.584722,-95.07388900000001,Estación de Biología Tropical Los Tuxtlas,1974.0,1,1,1,,WGS84,2019,J.I. Calzada
46246,PRESERVED_SPECIMEN,Crossopetalum parviflorum,P1328,GBIF,,Manuel Vargas,,17.925556,-96.103889,"La Joya del Obispo, predio en el Rancho El Tochero, 10 km al E de San Agustín, Distrito Tuxtepec",1990.0,1,1,1,,WGS84,2019,C.H. Ramos; E. Martínez S.
46247,PRESERVED_SPECIMEN,Crossopetalum parviflorum,V041282,GBIF,,Manuel Vargas,,17.2525,-94.612778,"Entre Campamento Hermanos Cedillo y La Escuadra, Río Solosúchil",1974.0,1,1,1,,WGS84,2019,M. Vázquez T.
46248,PRESERVED_SPECIMEN,Crossopetalum parviflorum,22180,GBIF,,Manuel Vargas,,20.725,-98.625,1.7 km al NE desviación a Tianguistengo,1983.0,1,1,1,,WGS84,2019,R. Torres C.; Heriberto Hernández G.
46249,PRESERVED_SPECIMEN,Crossopetalum parviflorum,P29289,GBIF,,Manuel Vargas,,20.658333,-98.575,4 km al N de Tlahuelompa,1981.0,1,1,1,,WGS84,2019,R. Hernández M.
46250,PRESERVED_SPECIMEN,Crossopetalum parviflorum,K412553,GBIF,,Manuel Vargas,,19.564722,-96.87916700000001,"Tiro de Hayas, Ejido El Sumidero",1989.0,1,1,1,,WGS84,2019,P. Zamora C.; G. Castillo-Campos
46251,PRESERVED_SPECIMEN,Crossopetalum parviflorum,22129,GBIF,,Manuel Vargas,,18.445,-95.060278,"Predio Pipiapan, Cerro Pipiapan",1987.0,1,1,1,,WGS84,2019,Eloy Garibay V.; R. Acosta P.
46252,PRESERVED_SPECIMEN,Crossopetalum parviflorum,V050195,GBIF,,Manuel Vargas,,17.791667,-94.658333,"Cerro Amarillo, laderas, reserva ejidal",1978.0,1,1,1,,WGS84,2019,G. Castillo-Campos
46253,PRESERVED_SPECIMEN,Crossopetalum parviflorum,V044754,GBIF,,Manuel Vargas,,16.958333,-95.091667,47 km carretera Campamento Hermanos Cedillo-Sarabia,1974.0,1,1,1,,WGS84,2019,J. Dorantes L.
46254,PRESERVED_SPECIMEN,Crossopetalum parviflorum,XAL0107083,GBIF,,Manuel Vargas,,17.258333,-94.591667,"Plan de Arroyo, 5 km, camino a Arroyo Alegre",1974.0,1,1,1,,WGS84,2019,J. Dorantes L.
46255,PRESERVED_SPECIMEN,Crossopetalum parviflorum,22138,GBIF,,Manuel Vargas,,17.259444000000002,-94.64416700000001,"2 km al N 2, Ejido Francisco Javier Mina",1982.0,1,1,1,,WGS84,2019,M. Vázquez T.; T. Wendt; I. Navarrete; A. García
46551,PRESERVED_SPECIMEN,Crossopetalum parviflorum,337343,GBIF,5135,Manuel Vargas,,9.0,-78.58,"Near the headwaters of the Río Piratí, foothills of the Serrania de Majé",1982.0,1,1,1,,WGS84,2019,S. D. Knapp
47217,PRESERVED_SPECIMEN,Crossopetalum parviflorum,BM001172205,GBIF,4015,Manuel Vargas,,14.4,-85.15,"Reserva Biológica BOSAWAS, comunidad de Inipuwas, area de caceria, transecto Ialnú",2007.0,1,1,1,,WGS84,2019,"Indiana M. Coronado González; b.1972; Coronado, Armingol Fernández"
47261,PRESERVED_SPECIMEN,Crossopetalum parviflorum,55555,GBIF,,Manuel Vargas,,17.808332999999998,-96.125,"Predio La Joya, Mpio. Santa María Jacatepec",1985.0,1,1,1,,WGS84,2019,C. López V.
47264,PRESERVED_SPECIMEN,Crossopetalum parviflorum,55556,GBIF,,Manuel Vargas,,17.808332999999998,-96.125,"Predio La Joya, Mpio. Santa María Jacatepec",1985.0,1,1,1,,WGS84,2019,F. Peña A.
48086,PRESERVED_SPECIMEN,Crossopetalum parviflorum,100882119,GBIF,Berger 1337,Manuel Vargas,,8.706667,-83.175278,"La Gamba, upside of waterfall ""Chorro"" at property of Don Camacho.",2013.0,1,1,1,,WGS84,2019,A. Berger
48296,PRESERVED_SPECIMEN,Crossopetalum parviflorum,1095915,GBIF,Stevens 8117,Manuel Vargas,,13.65,-84.4,Ca. 3.9 km SE of El Empalme on road to Limbaika; roadside and tall evergreen forest.,1978.0,1,1,1,,WGS84,2019,W. D. Stevens
48477,PRESERVED_SPECIMEN,Crossopetalum parviflorum,1179019,GBIF,Rueda 4983,Manuel Vargas,,14.366660000000001,-84.6,"Municipio de Waspan, Reserva Bosawas, sobre el Río Waspuk, 300 m despues del rápido wavla kumbas, luego oeste hasta el cerro Suyakno Tuná Azan.",1996.0,1,1,1,,WGS84,2019,R.M. Rueda|Alfredo Grijalva P.|R. Dolmus|M. Castrillo
48487,PRESERVED_SPECIMEN,Crossopetalum parviflorum,1179656,GBIF,Rueda 5423,Manuel Vargas,,11.01666,-84.2,"Reserva Indio-Maíz, Municipio de el Castillo, Cerro el Diablo.",1997.0,1,1,1,,WGS84,2019,R.M. Rueda|I. Coronado G.|O. Aráuz|F. Flores
48648,PRESERVED_SPECIMEN,Crossopetalum parviflorum,1222266,GBIF,Hammel 20347,Manuel Vargas,,10.68,-84.18,"Llanura de San Carlos, ca. 7 km NE de Boca Tapada, Lagarto Lodge",1996.0,1,1,1,,WGS84,2019,Barry E. Hammel
49100,PRESERVED_SPECIMEN,Crossopetalum parviflorum,1257846,GBIF,Aguilar Fernández 4241,Manuel Vargas,,8.46,-83.58,"P.N. Corcovado. Península de Osa. Estacion Sirena, sendero Ollas.",1995.0,1,1,1,,WGS84,2019,Reinaldo Aguilar
49144,PRESERVED_SPECIMEN,Crossopetalum parviflorum,1258602,GBIF,Aguilar Fernández 4941,Manuel Vargas,,8.46,-83.58,P.N. Corcovado. Peninsula de Osa. Estacion Sirena. Sendero Espaveles.,1997.0,1,1,1,,WGS84,2019,Reinaldo Aguilar
49178,PRESERVED_SPECIMEN,Crossopetalum parviflorum,1259348,GBIF,Aguilar Fernández 3717,Manuel Vargas,,8.565278,-83.388889,Península de Osa. Puerto Jimenez. Agujas.,1995.0,1,1,1,,WGS84,2019,Reinaldo Aguilar
49183,PRESERVED_SPECIMEN,Crossopetalum parviflorum,1259411,GBIF,Aguilar Fernández 3122,Manuel Vargas,,8.61,-83.73,"Estacion San Pedrillo, alrededor del limite.",1994.0,1,1,1,,WGS84,2019,Reinaldo Aguilar
49275,PRESERVED_SPECIMEN,Crossopetalum parviflorum,1264046,GBIF,Stevens 6754,Manuel Vargas,,13.766667000000002,-85.0,S slope of Cerro El Inocente.,1978.0,1,1,1,,WGS84,2019,W. D. Stevens
49325,PRESERVED_SPECIMEN,Crossopetalum parviflorum,1270543,GBIF,Stevens 7329,Manuel Vargas,,13.691667,-84.841667,"Vicinity of Waní, including Río Ulí; river banks.",1978.0,1,1,1,,WGS84,2019,W. D. Stevens
49523,PRESERVED_SPECIMEN,Crossopetalum parviflorum,1289176,GBIF,Rueda 7359,Manuel Vargas,,13.55,-85.76666,"Reserva Bosawas, Muncipio de Wiwili, Río Coco, poblado de Walaquitan, Cerro Muzu.",1997.0,1,1,1,,WGS84,2019,R.M. Rueda|I. Coronado G.
49581,PRESERVED_SPECIMEN,Crossopetalum parviflorum,1292652,GBIF,Martínez Salas 23148,Manuel Vargas,,15.784722,-88.8625,En el camino de laguna Salvador a Cálix; Biotopo Chocón Machacas.,1988.0,1,1,1,,WGS84,2019,Esteban M. Martínez S.|Pedro Tenorio L.|Herbert Droege|Ava Nury Díaz
49582,PRESERVED_SPECIMEN,Crossopetalum parviflorum,1292659,GBIF,Tenorio L. 14980,Manuel Vargas,,15.789444,-88.866111,"Creek Jute, Biotopo Chocón Machacas.",1988.0,1,1,1,,WGS84,2019,Pedro Tenorio L.|Esteban M. Martínez S.|Herbert Droege|Ava Nury Díaz
49623,PRESERVED_SPECIMEN,Crossopetalum parviflorum,1296522,GBIF,Stevens 13074,Manuel Vargas,,14.25,-84.6,Along Río Waspuk ca. 1 km upstream from confluence of Río Pis Pis; river margin.,1979.0,1,1,1,,WGS84,2019,W. D. Stevens
49975,PRESERVED_SPECIMEN,Crossopetalum parviflorum,1334928,GBIF,Rueda 10053,Manuel Vargas,,11.366660000000001,-84.01666,"Municipio de Nueva Guinea, Reserva Indio-Maiz, Río Pijibaye entre el  Caño Bijagua y el Cerro Chiripa",1999.0,1,1,1,,WGS84,2019,R.M. Rueda|I. Coronado G.|O. Caballero|L. Ruíz
50213,PRESERVED_SPECIMEN,Crossopetalum parviflorum,1369160,GBIF,Moraga López 218,Manuel Vargas,,8.569167,-83.506389,"P.N. Corcovado. Península de Osa. Estación Los Patos, cerca de la Estación bosque primario.",1995.0,1,1,1,,WGS84,2019,Marcos Moraga
50223,PRESERVED_SPECIMEN,Crossopetalum parviflorum,1369127,GBIF,Segura Castillo 222,Manuel Vargas,,8.733333,-83.333333,Valle de Coto Colorado. Riberas del Río Esquinas. Boca del Rio Esquinas.,1993.0,1,1,1,,WGS84,2019,Marianela Segura|F. J. Quesada|María Marta Chavarría
50225,PRESERVED_SPECIMEN,Crossopetalum parviflorum,1369173,GBIF,Harmon 336,Manuel Vargas,,8.66,-83.71,"Canton de Osa, R.F. Golfo Dulce. Peninsula De Osa. Playa Campanario o San Josecito. Sierpe. Primary Forest.",1993.0,1,1,1,,WGS84,2019,Patrick K. Harmon
50228,PRESERVED_SPECIMEN,Crossopetalum parviflorum,1369102,GBIF,Rodríguez González 2285,Manuel Vargas,,9.67,-83.02,Flora De Costa Rica. Cuenca Del Estrella. Hitoy Cerere: Sendero en los alrededores de la estacion.,1997.0,1,1,1,,WGS84,2019,Alexánder Rodríguez|Armando Soto
50231,PRESERVED_SPECIMEN,Crossopetalum parviflorum,1369190,GBIF,Estrada Chavarría 420,Manuel Vargas,,9.9,-83.17,Faja Costeña de Limón. Asunción.,1995.0,1,1,1,,WGS84,2019,Armando Estrada|Alexánder Rodríguez|Quírico Jiménez
50232,PRESERVED_SPECIMEN,Crossopetalum parviflorum,1369146,GBIF,Estrada Chavarría 377,Manuel Vargas,,9.9,-83.17,Flora De Costa Rica. Faja Costena De Limon. Asuncion. En bosque intervenido.,1995.0,1,1,1,,WGS84,2019,Armando Estrada
50588,PRESERVED_SPECIMEN,Crossopetalum parviflorum,1410978,GBIF,Nelson 5758,Manuel Vargas,,15.260556,-87.97416700000001,"Orilla del Río Humuya, 40 km N Santa Cruz de Yojoa.",1980.0,1,1,1,,WGS84,2019,Cirilo H. Nelson|Efraín Romero|Héctor A. Martínez C.|Roberto Andino U.|Rosario Rodríguez|Ana L. Díaz
50591,PRESERVED_SPECIMEN,Crossopetalum parviflorum,1410976,GBIF,Chan V. 6419,Manuel Vargas,,18.05,-90.86,Estado de México rumbo a Monclova.,1986.0,1,1,1,,WGS84,2019,C. Chan V.
50592,PRESERVED_SPECIMEN,Crossopetalum parviflorum,1410974,GBIF,Cabrera Cano 3271,Manuel Vargas,,18.44,-88.53,"En El Palmer, a 7 kM al sur de Ucum, sobre la carretera a La Union, Veg: Riparia",1982.0,1,1,1,,WGS84,2019,Edgar Fco. Cabrera C.|H. de Cabrera
50593,PRESERVED_SPECIMEN,Crossopetalum parviflorum,1410973,GBIF,Cabrera Cano 12386,Manuel Vargas,,17.39,-91.99,"En Mizol-Ha, aproximadamente 40 km al S de Palenque sobre la carretera Catazaja-Ococingo. Cerca de un escurrimiento permanente. [Mizol-Ha located approx. 18 km S of Palenque].",1986.0,1,1,1,,WGS84,2019,Edgar Fco. Cabrera C.|H. de Cabrera
50602,PRESERVED_SPECIMEN,Crossopetalum parviflorum,1411109,GBIF,Mori 2695,Manuel Vargas,,9.318333,-79.955,Trail along Río Petitpie from road to Ft. Sherman from Gatun Locks (S2 or 82).,1974.0,1,1,1,,WGS84,2019,Scott A. Mori|Jacquelyn A. Kallunki
50603,PRESERVED_SPECIMEN,Crossopetalum parviflorum,1411174,GBIF,Sytsma 1982,Manuel Vargas,,9.213889,-79.384722,"Cerro Jefe, cloud forest",1980.0,1,1,1,,WGS84,2019,Kenneth J. Sytsma
50604,PRESERVED_SPECIMEN,Crossopetalum parviflorum,1411148,GBIF,Liesner 1648,Manuel Vargas,,17.56666,-88.33333,Belize River .5 mi. W and E of Ridge Lagoon Plantation at Mile 11 on Northern Hwy. Collected from boat. Near sea level.,1974.0,1,1,1,,WGS84,2019,Ronald L. Liesner|John D. Dwyer
