,BasisOfRec,Binomial,CatalogNo,Citation,CollectID,Compiler,Data_sens,Dec_Lat,Dec_Long,Dist_comm,Event_Year,Origin,Presence,Seasonal,Sens_comm,SpatialRef,YrCompiled,recordedBy
2862,PRESERVED_SPECIMEN,Inga tenuiloba,1602038,GBIF,,Manuel Vargas,,8.7,-83.594445,"Rancho Quemado, fila al Oeste, Tierra Grupo Conservacion. A tanques de agua.",1993.0,1,1,1,,WGS84,2019,Nelson A. Zamora Villalobos
2866,PRESERVED_SPECIMEN,Inga tenuiloba,1602047,GBIF,,Manuel Vargas,,8.683419,-83.516654,"Agua Buena, Rincon. Aguas arriba a partir del tanque de agua del pueblo. Bosque primario.",1990.0,1,1,1,,WGS84,2019,Carlos Morales
13783,PRESERVED_SPECIMEN,Inga tenuiloba,1240124,GBIF,2175,Manuel Vargas,,8.7167,-83.5806,"Península de Osa; fila al oeste de Rancho Quemado, tierra de conservacón, por la trocha a los tanques de agua",1993.0,1,1,1,,WGS84,2019,N. A. Zamora Villalobos
35374,PRESERVED_SPECIMEN,Inga tenuiloba,902371,GBIF,Zamora Villalobos 2175,Manuel Vargas,,8.7,-83.59,"R.F. Golfo Dulce; Península de Osa. Rancho Quemado, fila al Oeste, Tierra Grupo Conservación. A tanques de agua.",1993.0,1,1,1,,WGS84,2019,Nelson Zamora|et al.
35719,PRESERVED_SPECIMEN,Inga tenuiloba,94018,GBIF,Morales Sánchez 149,Manuel Vargas,,8.683333,-83.516667,"Agua Buena, Rincón. Aguas arriba a partir del tanque de agua del pueblo.",1990.0,1,1,1,,WGS84,2019,Carlos O. Morales
