,BasisOfRec,Binomial,CatalogNo,Citation,CollectID,Compiler,Data_sens,Dec_Lat,Dec_Long,Dist_comm,Event_Year,Origin,Presence,Seasonal,Sens_comm,SpatialRef,YrCompiled,recordedBy
52929,PRESERVED_SPECIMEN,Protium panamense,1990980,GBIF,Croat 4834,Manuel Vargas,,9.16388,-79.83471999999999,Barro Colorado Island. Fairchild Point,1968.0,1,1,1,,WGS84,2019,Thomas B. Croat
52933,PRESERVED_SPECIMEN,Protium panamense,1991382,GBIF,Croat 5087,Manuel Vargas,,9.17083,-79.84444,Barro Colorado Island. Western side of Gross point peninsula from point to S edge of central deep cove,1968.0,1,1,1,,WGS84,2019,Thomas B. Croat
52934,PRESERVED_SPECIMEN,Protium panamense,1992076,GBIF,Croat 15050,Manuel Vargas,,9.15472,-79.84805,Barro Colorado Island. East side of Gross Peninsula.,1971.0,1,1,1,,WGS84,2019,Thomas B. Croat
54028,PRESERVED_SPECIMEN,Protium panamense,2156161,GBIF,Schmalzel 1184,Manuel Vargas,,9.16361,-79.82805,Barro Colorado Island. Bat Cove,1982.0,1,1,1,,WGS84,2019,Robert J. Schmalzel
54031,PRESERVED_SPECIMEN,Protium panamense,2156900,GBIF,Schmalzel 952,Manuel Vargas,,9.16361,-79.82805,Barro Colorado Island. Bat Cove,1982.0,1,1,1,,WGS84,2019,Robert J. Schmalzel|Eugene Schupp
54192,PRESERVED_SPECIMEN,Protium panamense,2178589,GBIF,Gómez Pignataro 20472,Manuel Vargas,,9.59,-82.87,7 km SW of Bribrí.,1983.0,1,1,1,,WGS84,2019,Luis Diego Gómez P.|Ronald L. Liesner|Emmet J. Judziewicz
56290,PRESERVED_SPECIMEN,Protium panamense,1189436,GBIF,11480,Manuel Vargas,,9.17,-82.0,"Chiriqui Lagoon, on Cayo Agua.",1987.0,1,1,1,,WGS84,2019,G. D. McPherson
56383,PRESERVED_SPECIMEN,Protium panamense,1189437,GBIF,11111,Manuel Vargas,,8.75,-82.25,"near Chiriqui Grande, on side-road c. 10 road-miles from continental divide.",1987.0,1,1,1,,WGS84,2019,G. D. McPherson
56462,PRESERVED_SPECIMEN,Protium panamense,544771,GBIF,120,Manuel Vargas,,8.650453,-77.35542199999999,"Bahía de Sapzurro, camino Sapzurro - Reserva Natural Parque Agua Viva.",2005.0,1,1,1,,WGS84,2019,Saúl E. Hoyos-Gómez | Andrés Upegui
56465,PRESERVED_SPECIMEN,Protium panamense,544737,GBIF,120,Manuel Vargas,,8.650453,-77.35542199999999,"Bahía de Sapzurro, Reserva Natural Parque Agua Viva, camino Sapzurro - Parque Agua Viva, Pérez Prado.",2005.0,1,1,1,,WGS84,2019,Saúl E. Hoyos-Gómez | Andrés Upegui
56466,PRESERVED_SPECIMEN,Protium panamense,544732,GBIF,548,Manuel Vargas,,8.646389,-77.366361,"Bahía de Sapzurro, camino Sapzurro - Capurganá - Alto El Parado.",2005.0,1,1,1,,WGS84,2019,Saúl E. Hoyos-Gómez | Andrés Upegui | E. Noreña | I Loaiza
56468,PRESERVED_SPECIMEN,Protium panamense,543468,GBIF,2881,Manuel Vargas,,8.409167,-77.141667,"Corregimiento de Chugandí, Vereda La Goleta.",2004.0,1,1,1,,WGS84,2019,A. Idárraga | F. Cardona
