,BasisOfRec,Binomial,CatalogNo,Citation,CollectID,Compiler,Data_sens,Dec_Lat,Dec_Long,Dist_comm,Event_Year,Origin,Presence,Seasonal,Sens_comm,SpatialRef,YrCompiled,recordedBy
39051,PRESERVED_SPECIMEN,Protium panamense,100574998,GBIF,Aguilar Fernández 11320,Manuel Vargas,,9.114722,-83.681667,"Distrito: Cortés; Palmar Norte, entre Ciudad Cortez y Dominical, Piñuelas arriba, finca de Vidal Jiménez.",2008.0,1,1,1,,WGS84,2019,Reinaldo Aguilar
39052,PRESERVED_SPECIMEN,Protium panamense,100574991,GBIF,Aguilar Fernández 11220,Manuel Vargas,,9.076667,-83.633611,"Distrito: Cortés; Ojochal, Playa Tortuga.",2008.0,1,1,1,,WGS84,2019,Reinaldo Aguilar
39896,PRESERVED_SPECIMEN,Protium panamense,MA-01-00759011,GBIF,2135,Manuel Vargas,,9.8833,-85.0611,Puntarenas: Puntarenas. No protegida. Península de Nicoya. Sendero Albert Ingalis,2001.0,1,1,1,,WGS84,2019,U. Chavarría & al.
40299,PRESERVED_SPECIMEN,Protium panamense,2200500,GBIF,Schmalzel 169,Manuel Vargas,,9.16055,-79.81944,Barro Colorado Island. Colorado Point,1981.0,1,1,1,,WGS84,2019,Robert J. Schmalzel
40311,PRESERVED_SPECIMEN,Protium panamense,2202015,GBIF,Schmalzel 131,Manuel Vargas,,9.13833,-79.84138,Barro Colorado Island. Burrunga Point,1981.0,1,1,1,,WGS84,2019,Robert J. Schmalzel|T. Mitchell Aide
40318,PRESERVED_SPECIMEN,Protium panamense,2202903,GBIF,Schmalzel 256,Manuel Vargas,,9.1475,-79.82526999999999,Barro Colorado Island. Near Channel Point,1981.0,1,1,1,,WGS84,2019,Robert J. Schmalzel
40326,PRESERVED_SPECIMEN,Protium panamense,2203777,GBIF,Schmalzel 85,Manuel Vargas,,9.17805,-79.84361,Barro Colorado Island. NE shore of BCI. Gross Peninsula,1981.0,1,1,1,,WGS84,2019,Robert J. Schmalzel|T. Mitchell Aide|Katie Milton
40356,PRESERVED_SPECIMEN,Protium panamense,2234942,GBIF,Peterson 6621,Manuel Vargas,,9.255,-82.28166,Isla San Cristóbal. 3-4 km W of Bocatorito. In moist tropical forest with Ficus,1989.0,1,1,1,,WGS84,2019,Paul M. Peterson|Carol R. Annable
40357,PRESERVED_SPECIMEN,Protium panamense,2235147,GBIF,VALDESPINO 440,Manuel Vargas,,9.58333,-79.5,"Cerro La Gloria, Nombre de Dios",1987.0,1,1,1,,WGS84,2019,VALDESPINO
40378,PRESERVED_SPECIMEN,Protium panamense,2240601,GBIF,Croat 36860,Manuel Vargas,,9.208333,-80.083333,Between Palma Bellas and Salud; near sea level.,1976.0,1,1,1,,WGS84,2019,Thomas B. Croat
40380,PRESERVED_SPECIMEN,Protium panamense,2240668,GBIF,Lara 54,Manuel Vargas,,8.45,-82.41666,"Bijagual, Corregimiento de Las Lomas, David. A 200 m de la casa del Sr. Francisco Lara, 10 m de la orilla del río (Potrero), brazo izquierdo del río Papayal.",1986.0,1,1,1,,WGS84,2019,Beatriz Lara|Guiilermo Lara
41653,PRESERVED_SPECIMEN,Protium panamense,2553510,GBIF,Duke 4397,Manuel Vargas,,9.27972,-79.9825,"Camp Piña. Vicinity of Hill C-6, Ft. Sherman",1961.0,1,1,1,,WGS84,2019,James A. Duke
42055,PRESERVED_SPECIMEN,Protium panamense,,GBIF,1,Manuel Vargas,,8.5714,-79.9106,,1860.0,1,1,1,,WGS84,2019,S. Hayes
42451,PRESERVED_SPECIMEN,Protium panamense,ASU0038157,GBIF,1841,Manuel Vargas,,9.17,-79.1,Prov. Panamá Camino a Llano Cartí Aproximadamente 14 kms de la carretera a Chepo,1973.0,1,1,1,,WGS84,2019,Mireya D. Correa A.; R.L. Dressler y D. Sucre
42455,PRESERVED_SPECIMEN,Protium panamense,ASU0038156,GBIF,1702,Manuel Vargas,,9.0096,-79.6032,Prov. Zona del Canal Gamboa Navy Pipe line.,1971.0,1,1,1,,WGS84,2019,"M. D. Correa; R. L. Dressler, N. Escobar, L. Carresquilla"
42458,PRESERVED_SPECIMEN,Protium panamense,ASU0038155,GBIF,1702,Manuel Vargas,,9.0096,-79.6032,Zona del Canal `Gamboa Navy Pipe line.,1971.0,1,1,1,,WGS84,2019,"M. D. Correa; R.L. Dressler, N. Escobar, L. Carrasquille"
42820,PRESERVED_SPECIMEN,Protium panamense,100917708,GBIF,Vergara-Pérez 894b,Manuel Vargas,,8.831945,-80.686111,"Area de concesion del Proyecto Minera Cobre Panama S. A., Valle Grande, Campamento 19.",,1,1,1,,WGS84,2019,Irving Vergara-Pérez
42822,PRESERVED_SPECIMEN,Protium panamense,100917671,GBIF,Vergara-Pérez 984b,Manuel Vargas,,8.831945,-80.686111,"Area de concesion del Proyecto Minera Cobre Panama S. A., Valle Grande, Campamento 19.",,1,1,1,,WGS84,2019,Irving Vergara-Pérez
42969,PRESERVED_SPECIMEN,Protium panamense,101008162,GBIF,Santamaría-Aguilar 9844,Manuel Vargas,,8.692222000000001,-83.59222199999999,Reserva Forestal Golfo Dulce. Rancho Quemado. Donde se ubica la antena del ICE.,2016.0,1,1,1,,WGS84,2019,Daniel Santamaría|Reinaldo Aguilar
45899,PRESERVED_SPECIMEN,Protium panamense,18800,GBIF,,Manuel Vargas,,9.159722,-79.848056,Barro Colorado Island,1981.0,1,1,1,,WGS84,2019,R.J. Schmalzel
46498,PRESERVED_SPECIMEN,Protium panamense,1209209,GBIF,20485,Manuel Vargas,,8.8322,-80.6589,Teck Cominco Petaquilla mining concession.,2008.0,1,1,1,,WGS84,2019,G. D. McPherson
46527,PRESERVED_SPECIMEN,Protium panamense,1209173,GBIF,5356,Manuel Vargas,,9.32,-78.92,"El Llano-Cartí Road, Km 26.5.",1985.0,1,1,1,,WGS84,2019,G. C. de Nevers
46547,PRESERVED_SPECIMEN,Protium panamense,1209199,GBIF,20880,Manuel Vargas,,8.9344,-80.7364,"Westernmost part of province, site of proposed copper mine (INMET).",2009.0,1,1,1,,WGS84,2019,G. D. McPherson
46582,PRESERVED_SPECIMEN,Protium panamense,1209179,GBIF,317,Manuel Vargas,,8.7,-83.57,Camino a la toma de agua.  Rancho Quemado Rincón.,1990.0,1,1,1,,WGS84,2019,F. Quesada
46602,PRESERVED_SPECIMEN,Protium panamense,1209200,GBIF,23588,Manuel Vargas,,8.71181,-80.62100000000001,"Area between Caño Blanco del Norte, Caño Sucio and Chorro del Rio Tife.",1983.0,1,1,1,,WGS84,2019,G. Davidse
46803,PRESERVED_SPECIMEN,Protium panamense,1209214,GBIF,3079,Manuel Vargas,,8.8233,-80.6625,Teck Cominco Mining Concession.  Camp Colina.,2008.0,1,1,1,,WGS84,2019,M. Merello
46875,PRESERVED_SPECIMEN,Protium panamense,1209183,GBIF,128,Manuel Vargas,,8.7667,-83.25,P.N. Corcovado.  Valle de Coto Colorado.  Estación Esquinas; Sección Esquinas.,1993.0,1,1,1,,WGS84,2019,M. Segura
46921,PRESERVED_SPECIMEN,Protium panamense,1209206,GBIF,9948,Manuel Vargas,,9.25,-79.0,"Along El Llano-Carti road, c. 4.6 miles from Pan-American Highway.  Side-trail through forest",1986.0,1,1,1,,WGS84,2019,G. D. McPherson
46927,PRESERVED_SPECIMEN,Protium panamense,1209207,GBIF,19824,Manuel Vargas,,8.8231,-80.6597,Teck Cominco Petaquilla mining concession.,2007.0,1,1,1,,WGS84,2019,G. D. McPherson
48045,PRESERVED_SPECIMEN,Protium panamense,100860650,GBIF,Batista G. 1178,Manuel Vargas,,8.515833,-81.118889,"Alto Piedra, PN Santa Fe, Cerro Mariposa.",2014.0,1,1,1,,WGS84,2019,Juvenal Batista|et al.
48076,PRESERVED_SPECIMEN,Protium panamense,100880534,GBIF,Ramos A. 373,Manuel Vargas,,8.835278,-80.678889,"Minera Panamá.  Valle Grande, Sierra 18.  Sendero de CABO.",,1,1,1,,WGS84,2019,Christel Ramos
48077,PRESERVED_SPECIMEN,Protium panamense,100880575,GBIF,Ramos A. 321,Manuel Vargas,,8.831389,-80.678333,"Minera Panamá.  Valle Grande, Sierra 18.",,1,1,1,,WGS84,2019,Christel Ramos
48579,PRESERVED_SPECIMEN,Protium panamense,120328,GBIF,Herrera 629,Manuel Vargas,,9.3,-78.166667,"Tierra firme frente a Playón Chico, Isla Popa.",1989.0,1,1,1,,WGS84,2019,Heraclio Herrera|Ovidio Guillen
48600,PRESERVED_SPECIMEN,Protium panamense,121175,GBIF,McPherson 11111,Manuel Vargas,,8.915556,-82.151667,"Near Chiriqui Grande, on side-road c. 10 road-miles from continental divide. [Coordinates on orginal label: 08º45'N, 82º15'W]",1987.0,1,1,1,,WGS84,2019,Gordon McPherson
48613,PRESERVED_SPECIMEN,Protium panamense,121470,GBIF,Aguilar Fernández 1291,Manuel Vargas,,8.730833,-83.408333,Cantón de Osa. Punta Pargos al Este del Tajo.,1992.0,1,1,1,,WGS84,2019,Reinaldo Aguilar
48627,PRESERVED_SPECIMEN,Protium panamense,122030,GBIF,Churchill 4041,Manuel Vargas,,8.758333,-80.526667,Logging camp 12 miles from Llano Grande.,1983.0,1,1,1,,WGS84,2019,H. W. Churchill|A. Liese|W. Scott Armbruster|A.L. Herzig
48630,PRESERVED_SPECIMEN,Protium panamense,122153,GBIF,McPherson 9917,Manuel Vargas,,8.75,-82.25,"Vicinity of Fortuna Dam. Along trail near Río Hornito, c. 8º45'N, 82º15'W. Forest. c. 1100 m.",1986.0,1,1,1,,WGS84,2019,Gordon McPherson
48631,PRESERVED_SPECIMEN,Protium panamense,122161,GBIF,McPherson 9948,Manuel Vargas,,9.25,-79.0,"Along El Llano-Carti road, c. 4.6 miles from Pan-American Highway. c. 9º15'N, 79º00'W. Side-trail through forest, c. 350 m.",1986.0,1,1,1,,WGS84,2019,Gordon McPherson
48644,PRESERVED_SPECIMEN,Protium panamense,122223,GBIF,de Nevers 6971,Manuel Vargas,,9.333333,-79.133333,"Yar Bired (Cerro San José), continental divide between Cangandí and San José.",1986.0,1,1,1,,WGS84,2019,Greg C. de Nevers|Heraclio Herrera
48650,PRESERVED_SPECIMEN,Protium panamense,122232,GBIF,de Nevers 5845,Manuel Vargas,,9.333333,-78.966667,El Llano-Cartí Rd. Km 19.1.,1985.0,1,1,1,,WGS84,2019,Greg C. de Nevers|Heraclio Herrera
48662,PRESERVED_SPECIMEN,Protium panamense,122260,GBIF,de Nevers 5112,Manuel Vargas,,9.333333,-78.966667,"El Llano-Cartí Road, Km 19.1. [Coordinates on original label: 9º19'N, 78º55'W].",1985.0,1,1,1,,WGS84,2019,Greg C. de Nevers|Heraclio Herrera
48677,PRESERVED_SPECIMEN,Protium panamense,122343,GBIF,de Nevers 5602,Manuel Vargas,,9.316667,-78.916667,"El Llano-Cartí road, Km 19.",1985.0,1,1,1,,WGS84,2019,Greg C. de Nevers|John Blake|Heraclio Herrera
48678,PRESERVED_SPECIMEN,Protium panamense,122398,GBIF,de Nevers 7284,Manuel Vargas,,9.333333,-78.966667,"El Llano-Cartí Road, Km 19.1.",1986.0,1,1,1,,WGS84,2019,Greg C. de Nevers|Heraclio Herrera
48679,PRESERVED_SPECIMEN,Protium panamense,122412,GBIF,de Nevers 5356,Manuel Vargas,,9.366667,-78.966667,"El Llano-Cartí Road. Km 26.5, along Río Cartí Chico. [Coordinates on original label: 9º19'N, 78º55'W]",1985.0,1,1,1,,WGS84,2019,Greg C. de Nevers|Heraclio Herrera|Susan Charnley
48680,PRESERVED_SPECIMEN,Protium panamense,122421,GBIF,McPherson 11480,Manuel Vargas,,9.149722,-82.033056,"Chiriquí Lagoon, on Cayo Agua.",1987.0,1,1,1,,WGS84,2019,Gordon McPherson
48681,PRESERVED_SPECIMEN,Protium panamense,122426,GBIF,de Nevers 5764,Manuel Vargas,,9.416667,-79.108333,"Cangandí.  [Coordinates on original label: 9º24'N, 79º24'W]",1985.0,1,1,1,,WGS84,2019,Greg C. de Nevers|Heraclio Herrera|Susan Charnley|Alfaro Díaz
48686,PRESERVED_SPECIMEN,Protium panamense,122500,GBIF,McPherson 9648,Manuel Vargas,,8.915833000000001,-82.151667,"Along road to Chiriquí Grande, c. 1.5 miles along side road east of highway.",1986.0,1,1,1,,WGS84,2019,Gordon McPherson|Bruce Allen
48763,PRESERVED_SPECIMEN,Protium panamense,123365,GBIF,de Nevers 5863,Manuel Vargas,,9.333333,-78.966667,El Llano-Cartí Rd. Km 19.1.,1985.0,1,1,1,,WGS84,2019,Greg C. de Nevers|Heraclio Herrera
48791,PRESERVED_SPECIMEN,Protium panamense,123664,GBIF,Chacón Gamboa 44,Manuel Vargas,,9.494444,-83.494444,"Talamanca, Amubri, Camino a Soki entre la quebrada Amubri, margen izquierda de Río Lari.",1989.0,1,1,1,,WGS84,2019,Abelardo Chacón
49142,PRESERVED_SPECIMEN,Protium panamense,1258505,GBIF,Aguilar Fernández 4852,Manuel Vargas,,8.46,-83.58,Estacion Sirena. Sendero Espaveles.,1997.0,1,1,1,,WGS84,2019,Reinaldo Aguilar
49431,PRESERVED_SPECIMEN,Protium panamense,1281044,GBIF,Gentry 6426,Manuel Vargas,,9.37138,-79.87861,Coco Solo,1972.0,1,1,1,,WGS84,2019,Alwyn H. Gentry
50197,PRESERVED_SPECIMEN,Protium panamense,1368036,GBIF,Espinoza Obando 1175,Manuel Vargas,,10.88,-85.4,"Parque Nacional Guanacaste, Cordillera de Guanacaste, Sector San Ramón,  Finca La Argentina.",1994.0,1,1,1,,WGS84,2019,Roberto Espinoza
50201,PRESERVED_SPECIMEN,Protium panamense,1368107,GBIF,Segura Castillo 128,Manuel Vargas,,8.766667,-83.25,P.N. Corcovado.  Valle de Coto Colorado.  Estación Esquinas; Sección Esquinas.,1993.0,1,1,1,,WGS84,2019,Marianela Segura|F. J. Quesada
50425,PRESERVED_SPECIMEN,Protium panamense,1388387,GBIF,Mori 2054,Manuel Vargas,,9.21222,-79.79222,"On Pipeline Road, 14.4 km from Chagres Airport Road",1974.0,1,1,1,,WGS84,2019,Scott A. Mori|Jacquelyn A. Kallunki
50428,PRESERVED_SPECIMEN,Protium panamense,1388439,GBIF,Thomsen 984,Manuel Vargas,,8.71,-83.51,"Aguabuena, 3.5 km W of Rincón. Four-hectare permanent sample plot 1 km N of BOSCOSA station in well-drained undulating terrain with slopes of 15-35º. Tall primary forest with many palms and large lianas. Characteristic species: Symphonia, Carapa, Brosimum utile, Qualea, Otoba, Iriartea and Vantanea.",1994.0,1,1,1,,WGS84,2019,Karsten Thomsen
50931,PRESERVED_SPECIMEN,Protium panamense,1485030,GBIF,Croat 11110,Manuel Vargas,,9.174439999999999,-79.85526999999999,"Barro Colorado Island, Miller Peninsula",1970.0,1,1,1,,WGS84,2019,Thomas B. Croat
50932,PRESERVED_SPECIMEN,Protium panamense,1485102,GBIF,Croat 15050,Manuel Vargas,,9.15472,-79.84805,Barro Colorado Island. East side of Gross Peninsula.,1971.0,1,1,1,,WGS84,2019,Thomas B. Croat
51753,PRESERVED_SPECIMEN,Protium panamense,1732871,GBIF,Gentry 2390,Manuel Vargas,,8.94027,-78.90276999999999,Forest near first bend on Río Pasiga,1971.0,1,1,1,,WGS84,2019,Alwyn H. Gentry
51759,PRESERVED_SPECIMEN,Protium panamense,1735147,GBIF,Gentry 2677,Manuel Vargas,,9.3,-82.4,Hillside above Almirante.,1971.0,1,1,1,,WGS84,2019,Alwyn H. Gentry
51774,PRESERVED_SPECIMEN,Protium panamense,1737096,GBIF,Gentry 3166,Manuel Vargas,,9.15194,-79.73638000000001,"Pipeline Road, 4 mi N of Gamboa. Wet forest. Transects 3 and 4 voucher",1971.0,1,1,1,,WGS84,2019,Alwyn H. Gentry
51802,PRESERVED_SPECIMEN,Protium panamense,1738533,GBIF,Gentry 1928-29,Manuel Vargas,,9.116660000000001,-79.71666,"Pipeline Road, premontane wet forest.",1971.0,1,1,1,,WGS84,2019,Alwyn H. Gentry
51839,PRESERVED_SPECIMEN,Protium panamense,1743998,GBIF,Gentry 4836,Manuel Vargas,,9.215,-79.97055,"Río Providencia, Tropic Test Center site at Ft. Sherman",1972.0,1,1,1,,WGS84,2019,Alwyn H. Gentry|Edwin L. Tyson
51849,PRESERVED_SPECIMEN,Protium panamense,1747075,GBIF,Gentry 5791,Manuel Vargas,,9.2625,-78.932778,"5-6 miles N of El Llano, near San Blas border.",1972.0,1,1,1,,WGS84,2019,Alwyn H. Gentry
51924,PRESERVED_SPECIMEN,Protium panamense,1777949,GBIF,Gentry 8847,Manuel Vargas,,9.35,-79.7,"Santa Rita Ridge road, 4 mi from Transisthmian Highway to Agua Clara weather station.",1973.0,1,1,1,,WGS84,2019,Alwyn H. Gentry|Robert L. Dressler|Cornelis C. Berg
52813,PRESERVED_SPECIMEN,Protium panamense,1984033,GBIF,Croat 7866,Manuel Vargas,,9.16,-79.819722,Barro Colorado Island; Shoreline south of Colorado Point.,1969.0,1,1,1,,WGS84,2019,Thomas B. Croat
52814,PRESERVED_SPECIMEN,Protium panamense,1983955,GBIF,Croat 6600,Manuel Vargas,,9.174445,-79.855278,Barro Colorado Island. Shoreline of large cove south of Orchid Isle near Miller Trail.,1968.0,1,1,1,,WGS84,2019,Thomas B. Croat
52815,PRESERVED_SPECIMEN,Protium panamense,1984305,GBIF,Croat 4832,Manuel Vargas,,9.16388,-79.83471999999999,Barro Colorado Island. Fairchild Point,1968.0,1,1,1,,WGS84,2019,Thomas B. Croat
52816,PRESERVED_SPECIMEN,Protium panamense,1984355,GBIF,Correa A. 1702,Manuel Vargas,,9.18333,-79.76666,Gamboa Navy Pipeline.,1971.0,1,1,1,,WGS84,2019,Mireya D. Correa A.|Robert L. Dressler|Novencido Escobar A.|Luis G. Carrasquilla
52817,PRESERVED_SPECIMEN,Protium panamense,1984145,GBIF,Montgomery 156,Manuel Vargas,,9.1625,-79.84166,Barro Colorado Island. Vicinity of Laboratory Clearing,1973.0,1,1,1,,WGS84,2019,Gene Montgomery
52818,PRESERVED_SPECIMEN,Protium panamense,1984760,GBIF,Gómez Pompa 3354b,Manuel Vargas,,9.33333,-79.78333,"Santa Rita. Cuadro de muestreo No. 2 en zona de selvas altas perennifolias sobre suelos rojos lateriticos, arcillosos. Secundaria",1968.0,1,1,1,,WGS84,2019,Arturo Gómez Pompa|Hermilo J. Quero Rico|J. González
52820,PRESERVED_SPECIMEN,Protium panamense,1984827,GBIF,Mori 2004,Manuel Vargas,,9.483333,-79.666667,"Trail S of Río Guanche, on ridge to Cerro Pan de Azucar. 17ppa453501-17ppa464501. Spondias and Sterculia apetala common along trail",1974.0,1,1,1,,WGS84,2019,Scott A. Mori|Jacquelyn A. Kallunki
52821,PRESERVED_SPECIMEN,Protium panamense,1984791,GBIF,Knight s.n.,Manuel Vargas,,9.15,-79.85,Barro Colorado Island,1967.0,1,1,1,,WGS84,2019,Dennis H. Knight
52822,PRESERVED_SPECIMEN,Protium panamense,1984887,GBIF,Sytsma 3991,Manuel Vargas,,9.26527,-78.935,"El Llano-Cartí Road, 6 mi from Pan American Hwy., wet forest",1981.0,1,1,1,,WGS84,2019,Kenneth J. Sytsma
52823,PRESERVED_SPECIMEN,Protium panamense,1985850,GBIF,Mori 6332,Manuel Vargas,,9.361388999999999,-79.721111,"On Santa Rita Ridge trail. Beyond end of Santa Rita Ridge Road (Panamanian Hwy R2OD), 17-35 km from Boyd-Roosevelt Hwy.",1975.0,1,1,1,,WGS84,2019,Scott A. Mori|Marshall R. Crosby
52824,PRESERVED_SPECIMEN,Protium panamense,1985632,GBIF,Nee 7921,Manuel Vargas,,9.250556,-78.934167,"El Llano-Cartí road, 5 km N of Pan-American Highway at El Llano",1973.0,1,1,1,,WGS84,2019,Michael H. Nee
52825,PRESERVED_SPECIMEN,Protium panamense,1985249,GBIF,von Wedel 2407,Manuel Vargas,,9.0,-82.23333000000001,"Fish Creek hills, vicinity of Chiriquí Lagoon",1941.0,1,1,1,,WGS84,2019,H. von Wedel
52826,PRESERVED_SPECIMEN,Protium panamense,1986168,GBIF,Liesner 671,Manuel Vargas,,9.311111,-78.94444399999999,Along newly cut road from El Llano to Carti-Tupile; 12 miles above Pan-Am Highway.,1973.0,1,1,1,,WGS84,2019,Ronald L. Liesner
52827,PRESERVED_SPECIMEN,Protium panamense,1985597,GBIF,von Wedel 2106,Manuel Vargas,,9.31666,-82.15,"Old Bank Island, vicinity of Chiriquí Lagoon.",1941.0,1,1,1,,WGS84,2019,H. von Wedel
52833,PRESERVED_SPECIMEN,Protium panamense,1986239,GBIF,Shattuck 1172,Manuel Vargas,,9.15833,-79.83888,Barro Colorado Island. Snyder-Molino Trail,1934.0,1,1,1,,WGS84,2019,Otis E. Shattuck
52834,PRESERVED_SPECIMEN,Protium panamense,1986153,GBIF,"Kirkbride, Jr. 563",Manuel Vargas,,9.375,-82.673333,Duwebdulup Peak north of Río Terebe across from Quebrada Huron,1968.0,1,1,1,,WGS84,2019,"Joseph H. Kirkbride, Jr.|James A. Duke"
52835,PRESERVED_SPECIMEN,Protium panamense,1986592,GBIF,Shattuck 1172,Manuel Vargas,,9.15833,-79.83888,Barro Colorado Island. Snyder-Molino Trail,1934.0,1,1,1,,WGS84,2019,Otis E. Shattuck
52836,PRESERVED_SPECIMEN,Protium panamense,1986776,GBIF,Croat 12721,Manuel Vargas,,9.16361,-79.83638,Barro Colorado Island. Near dock,1970.0,1,1,1,,WGS84,2019,Thomas B. Croat
52840,PRESERVED_SPECIMEN,Protium panamense,1987539,GBIF,Mendoza 328,Manuel Vargas,,8.733333,-82.233333,"Al este del sitio de presa, en Fortuna.",1976.0,1,1,1,,WGS84,2019,Rodolfo Mendoza
52841,PRESERVED_SPECIMEN,Protium panamense,1987509,GBIF,Lao 29,Manuel Vargas,,9.16666,-79.76666,"Pipeline Road, premontane wet forest area",1971.0,1,1,1,,WGS84,2019,E.A. Lao|Leslie R. Holdridge|Alwyn H. Gentry
52842,PRESERVED_SPECIMEN,Protium panamense,1987952,GBIF,Woodworth 425,Manuel Vargas,,9.17388,-79.83444,"Barro Colorado Island, Canal Zone. Salud Point",1932.0,1,1,1,,WGS84,2019,R.H. Woodworth|P.A. Vestal
52848,PRESERVED_SPECIMEN,Protium panamense,1988189,GBIF,Ebinger 9,Manuel Vargas,,9.15833,-79.83888,"Barro Colorado Island, Snyder Molino Trail",1960.0,1,1,1,,WGS84,2019,John E. Ebinger
52849,PRESERVED_SPECIMEN,Protium panamense,1988236,GBIF,Mori 2139,Manuel Vargas,,9.35,-79.76666,"Santa Rita Ridge Road, ca. 6 km from Boyd-Roosevelt Hwy. 17PPA357328",1974.0,1,1,1,,WGS84,2019,Scott A. Mori|Jacquelyn A. Kallunki
52852,PRESERVED_SPECIMEN,Protium panamense,1988116,GBIF,Croat 7124,Manuel Vargas,,9.16361,-79.83638,Barro Colorado Island.  Lakeshore N of dock,1969.0,1,1,1,,WGS84,2019,Thomas B. Croat
52853,PRESERVED_SPECIMEN,Protium panamense,1988724,GBIF,Croat 4409,Manuel Vargas,,9.1625,-79.8375,"Snyder-Molino Trail, Barro Colorado Island.",1967.0,1,1,1,,WGS84,2019,Thomas B. Croat
52854,PRESERVED_SPECIMEN,Protium panamense,1988333,GBIF,Garwood 1483A,Manuel Vargas,,9.16,-79.86,"Shoreline, Peña Blanca East to Fuertes Cove, Barro Colorado Island",1985.0,1,1,1,,WGS84,2019,Nancy C. Garwood
52858,PRESERVED_SPECIMEN,Protium panamense,1988253,GBIF,von Wedel 2625,Manuel Vargas,,9.2,-82.28333,"Darkland, vicinity of Chiriquí Lagoon.",1941.0,1,1,1,,WGS84,2019,H. von Wedel
52862,PRESERVED_SPECIMEN,Protium panamense,1988649,GBIF,Montgomery 187,Manuel Vargas,,9.1625,-79.84166,"Vicinity of Laboratory Clearing. Lake shore east of Donato 1, just south of pipe for island water supply.",1973.0,1,1,1,,WGS84,2019,Gene Montgomery
52863,PRESERVED_SPECIMEN,Protium panamense,1989125,GBIF,Solís Rojas 434,Manuel Vargas,,10.22,-83.83,Vecundides del Rio Tro Amorillo. (finca vieja). REg Attant.,1936.0,1,1,1,,WGS84,2019,Fernando Solís Rojas
52866,PRESERVED_SPECIMEN,Protium panamense,1988872,GBIF,de Nevers 5602,Manuel Vargas,,9.316667,-78.916667,"El Llano-Cartí road, Km 19.",1985.0,1,1,1,,WGS84,2019,Greg C. de Nevers|John Blake|Heraclio Herrera
52867,PRESERVED_SPECIMEN,Protium panamense,1988873,GBIF,Wilson 125,Manuel Vargas,,9.15,-79.86666,"Barro Colorado Island.  On shore, west side of Barro Colorado Island",1931.0,1,1,1,,WGS84,2019,Charles L. Wilson
52869,PRESERVED_SPECIMEN,Protium panamense,1988794,GBIF,von Wedel 2115,Manuel Vargas,,9.31666,-82.15,"Old Bank Island, vicinity of Chiriquí Lagoon.",1941.0,1,1,1,,WGS84,2019,H. von Wedel
52870,PRESERVED_SPECIMEN,Protium panamense,1989269,GBIF,Croat 6067,Manuel Vargas,,9.16361,-79.83638,Barro Colorado Island. Shoreline of cove,1968.0,1,1,1,,WGS84,2019,Thomas B. Croat
52871,PRESERVED_SPECIMEN,Protium panamense,1989491,GBIF,Allen 3429,Manuel Vargas,,9.28333,-79.98333000000001,Vicinity of Camp Pina,1946.0,1,1,1,,WGS84,2019,Paul H. Allen
52873,PRESERVED_SPECIMEN,Protium panamense,1988801,GBIF,Croat 4235,Manuel Vargas,,9.17222,-79.83610999999999,"Barro Colorado Island, Salud Point.",1967.0,1,1,1,,WGS84,2019,Thomas B. Croat
52875,PRESERVED_SPECIMEN,Protium panamense,1989543,GBIF,Croat 6384,Manuel Vargas,,9.168611,-79.85194399999999,Barro Colorado Island. Rear number 8 Light House Clearing.,1968.0,1,1,1,,WGS84,2019,Thomas B. Croat
52876,PRESERVED_SPECIMEN,Protium panamense,1989851,GBIF,Shattuck 891,Manuel Vargas,,9.17388,-79.83444,Barro Colorado Island. Fairchild Point,1934.0,1,1,1,,WGS84,2019,Otis E. Shattuck
52879,PRESERVED_SPECIMEN,Protium panamense,1989200,GBIF,Correa A. 1841,Manuel Vargas,,9.25333,-78.95305,Colectado en camino de Llano a Cartí. Aproximadamente 14 kms. de la carretera a Chepo,1973.0,1,1,1,,WGS84,2019,Mireya D. Correa A.|Robert L. Dressler|Dimitri Sucre
52882,PRESERVED_SPECIMEN,Protium panamense,1989775,GBIF,Woodworth 462,Manuel Vargas,,9.15,-79.85,Barro Colorado Island.  Shore of cove south of Fr. Lock Site,1932.0,1,1,1,,WGS84,2019,R.H. Woodworth|P.A. Vestal
52889,PRESERVED_SPECIMEN,Protium panamense,1990345,GBIF,Croat 8389,Manuel Vargas,,9.17,-79.84,"Barro Colorado Island.  Eastern edge of Orchid Island near French cut, Gross Point",1969.0,1,1,1,,WGS84,2019,Thomas B. Croat
52890,PRESERVED_SPECIMEN,Protium panamense,1990125,GBIF,Nee 8635,Manuel Vargas,,9.32916,-79.98971999999999,"Tropical moist forest along road S-8, at Quebrada La Furnia, 1.5 km SW of mouth of Chagres River",1976.0,1,1,1,,WGS84,2019,Michael H. Nee
52894,PRESERVED_SPECIMEN,Protium panamense,1990132,GBIF,Garwood 2189A,Manuel Vargas,,9.17388,-79.83444,"Small lakeside clearing off Fairchild 17-18, Barro Colorado Island",1985.0,1,1,1,,WGS84,2019,Nancy C. Garwood
52895,PRESERVED_SPECIMEN,Protium panamense,1990480,GBIF,Croat 15403,Manuel Vargas,,9.270556,-79.923333,Along road between Gatun Locks and Fort Sherman,1971.0,1,1,1,,WGS84,2019,Thomas B. Croat|Duncan M. Porter
52900,PRESERVED_SPECIMEN,Protium panamense,1990495,GBIF,Dwyer s.n.,Manuel Vargas,,9.15,-79.85,Barro Colorado Island,1968.0,1,1,1,,WGS84,2019,John D. Dwyer|Mireya D. Correa A.|R. Pasco
52901,PRESERVED_SPECIMEN,Protium panamense,1990060,GBIF,Holdridge 6256,Manuel Vargas,,8.933333,-80.416667,Camp Betija.,1968.0,1,1,1,,WGS84,2019,Leslie R. Holdridge
52905,PRESERVED_SPECIMEN,Protium panamense,1991029,GBIF,Gordon 4,Manuel Vargas,,8.78333,-81.53333,Río San Pedro.,1978.0,1,1,1,,WGS84,2019,Burton L. Gordon
52906,PRESERVED_SPECIMEN,Protium panamense,1990415,GBIF,Zetek 3467,Manuel Vargas,,9.15,-79.85,Barro Colorado Island,1935.0,1,1,1,,WGS84,2019,J. Zetek
52908,PRESERVED_SPECIMEN,Protium panamense,1990203,GBIF,Dwyer 1435,Manuel Vargas,,9.15,-79.85,Barro Colorado Island,1961.0,1,1,1,,WGS84,2019,John D. Dwyer
52910,PRESERVED_SPECIMEN,Protium panamense,1990907,GBIF,Shattuck 635,Manuel Vargas,,9.16361,-79.83805,Barro Colorado Island. Frank Lutz Trail,1931.0,1,1,1,,WGS84,2019,Otis E. Shattuck
52911,PRESERVED_SPECIMEN,Protium panamense,1990205,GBIF,Sugden 515,Manuel Vargas,,8.808333,-77.675,Studies of evergreen lowland seasonal rainforest on the Aila Terrain (Rio Acla).,1979.0,1,1,1,,WGS84,2019,Andrew M. Sugden
52914,PRESERVED_SPECIMEN,Protium panamense,1990693,GBIF,Croat 7350,Manuel Vargas,,9.162778,-79.833056,"Barro Colorado Island, shoreline of large cove southwest of Slothia Island.",1969.0,1,1,1,,WGS84,2019,Thomas B. Croat
52915,PRESERVED_SPECIMEN,Protium panamense,1991304,GBIF,Tyson 3755,Manuel Vargas,,9.36416,-79.95666,Road from Fort Sherman to Fort San Lorenzo,1966.0,1,1,1,,WGS84,2019,Edwin L. Tyson|Kurt E. Blum
52918,PRESERVED_SPECIMEN,Protium panamense,1991260,GBIF,Nee 8934,Manuel Vargas,,9.297778,-80.016111,"Vicinity of towers on Loma La Toba, 3 km SW of mouth of Chagres River.",1973.0,1,1,1,,WGS84,2019,Michael H. Nee
52919,PRESERVED_SPECIMEN,Protium panamense,1990832,GBIF,Elias 1717,Manuel Vargas,,9.0,-77.75,"Isla Pino, near Mulatupo Island, ca. 3-4 miles by 1 mile broad.",1967.0,1,1,1,,WGS84,2019,Thomas S. Elias
52921,PRESERVED_SPECIMEN,Protium panamense,1991311,GBIF,Mori 3479,Manuel Vargas,,9.28055,-79.40416,Gorgas Memorial Labs Yellow Fever Research Camp ca. 25 km NE of Cerro Azul on Río Piedras; near fork in river,1974.0,1,1,1,,WGS84,2019,Scott A. Mori|Jacquelyn A. Kallunki
52922,PRESERVED_SPECIMEN,Protium panamense,1991183,GBIF,Woodworth 490,Manuel Vargas,,9.16277,-79.83305,Barro Colorado Island. Shore E of laboratory,1932.0,1,1,1,,WGS84,2019,R.H. Woodworth|P.A. Vestal
52926,PRESERVED_SPECIMEN,Protium panamense,1991407,GBIF,Woodworth 559,Manuel Vargas,,9.141389,-79.843055,Barro Colorado Island. Near Drayton House.,1932.0,1,1,1,,WGS84,2019,R.H. Woodworth|P.A. Vestal
