,BasisOfRec,Binomial,CatalogNo,Citation,CollectID,Compiler,Data_sens,Dec_Lat,Dec_Long,Dist_comm,Event_Year,Origin,Presence,Seasonal,Sens_comm,SpatialRef,YrCompiled,recordedBy
139,UNKNOWN,Sapium allenii,100081579,GBIF,,Manuel Vargas,,8.68333,-83.2167,"P.N. Esquinas, ""Bosque de los Austriacos"", Sendero Catarata, near the Esquinas-Rainforest-Lodge, La Gamba",1998.0,1,1,1,,WGS84,2019,"Huber Werner, Weissenhofer Anton"
140,UNKNOWN,Sapium allenii,100081580,GBIF,,Manuel Vargas,,8.68333,-83.2167,"P.N. Esquinas, ""Bosque de los Austriacos"", Sendero Catarata, near the Esquinas-Rainforest-Lodge, La Gamba",1998.0,1,1,1,,WGS84,2019,"Huber Werner, Weissenhofer Anton"
597,PRESERVED_SPECIMEN,Sapium allenii,1527227,GBIF,,Manuel Vargas,,8.481076,-83.595012,Sendero Espaveles,1997.0,1,1,1,,WGS84,2019,Reinaldo Aguilar
611,PRESERVED_SPECIMEN,Sapium allenii,1527364,GBIF,,Manuel Vargas,,8.481076,-83.595012,Sendero Espaveles,1997.0,1,1,1,,WGS84,2019,Reinaldo Aguilar
612,PRESERVED_SPECIMEN,Sapium allenii,1527366,GBIF,,Manuel Vargas,,8.481076,-83.595012,Sendero Espaveles,1997.0,1,1,1,,WGS84,2019,Reinaldo Aguilar
613,PRESERVED_SPECIMEN,Sapium allenii,1527365,GBIF,,Manuel Vargas,,8.481076,-83.595012,Sendero Espaveles,1997.0,1,1,1,,WGS84,2019,Reinaldo Aguilar
3191,PRESERVED_SPECIMEN,Sapium allenii,1581398,GBIF,,Manuel Vargas,,8.480556,-83.591667,"Sendero Ollas, sector a 10 msnm",1994.0,1,1,1,,WGS84,2019,Reinaldo Aguilar
4034,PRESERVED_SPECIMEN,Sapium allenii,2850019,GBIF,,Manuel Vargas,,8.683333,-83.216667,"Fila Gamba, 3 Km NE camino entre Golfito y Villa Briceno.",1998.0,1,1,1,,WGS84,2019,Werner Huber; A. Weissenhofer
6865,PRESERVED_SPECIMEN,Sapium allenii,3445250,GBIF,,Manuel Vargas,,8.795077000000001,-82.95950500000001,Jardín Botanico Las Cruces,1998.0,1,1,1,,WGS84,2019,Reinaldo Aguilar
6866,PRESERVED_SPECIMEN,Sapium allenii,3445251,GBIF,,Manuel Vargas,,8.795077000000001,-82.95950500000001,Jardín Botanico Las Cruces,1998.0,1,1,1,,WGS84,2019,Reinaldo Aguilar
12523,PRESERVED_SPECIMEN,Sapium allenii,4400623,GBIF,,Manuel Vargas,,8.498694,-83.367944,"Área de Conservación Osa, Reserva Forestal Golfo Dulce, Río Nuevo, finca Gonzalo Cordero.",2014.0,1,1,1,,WGS84,2019,Nelson A. Zamora Villalobos; William Montero ; Guillermo Villalobos ; Jose Antonio Azofeifa Zuñiga
12524,PRESERVED_SPECIMEN,Sapium allenii,4400622,GBIF,,Manuel Vargas,,8.498694,-83.367944,"Área de Conservación Osa, Reserva Forestal Golfo Dulce, Río Nuevo, finca Gonzalo Cordero.",2014.0,1,1,1,,WGS84,2019,Nelson A. Zamora Villalobos; William Montero ; Guillermo Villalobos ; Jose Antonio Azofeifa Zuñiga
12525,PRESERVED_SPECIMEN,Sapium allenii,4400624,GBIF,,Manuel Vargas,,8.498694,-83.367944,"Área de Conservación Osa, Reserva Forestal Golfo Dulce, Río Nuevo, finca Gonzalo Cordero.",2014.0,1,1,1,,WGS84,2019,Nelson A. Zamora Villalobos; William Montero ; Guillermo Villalobos ; Jose Antonio Azofeifa Zuñiga
25402,PRESERVED_SPECIMEN,Sapium allenii,220668,GBIF,,Manuel Vargas,,8.48,-83.59,"P. N. Corcovado Estación Sirena, sendero Espaveles. Península de Osa.",1997.0,1,1,1,,WGS84,2019,"Aguilar, Reinaldo"
33878,PRESERVED_SPECIMEN,Sapium allenii,V0057076F,GBIF,5773,Manuel Vargas,,10.0114,-83.9519,,1951.0,1,1,1,,WGS84,2019,P. H. Allen
42640,PRESERVED_SPECIMEN,Sapium allenii,488,GBIF,,Manuel Vargas,,8.728333000000001,-82.942778,,,1,1,1,,WGS84,2019,
42704,PRESERVED_SPECIMEN,Sapium allenii,2555,GBIF,,Manuel Vargas,,8.785139,-82.959097,,,1,1,1,,WGS84,2019,
43017,PRESERVED_SPECIMEN,Sapium allenii,101068966,GBIF,Santamaría-Aguilar 9362,Manuel Vargas,,8.681111,-83.54916700000001,Golfito. Carretera a Rancho Quemado. Fila entre Baneguitas y Rancho Quemado.,2012.0,1,1,1,,WGS84,2019,Daniel Santamaría|Reinaldo Aguilar
43073,PRESERVED_SPECIMEN,Sapium allenii,101131341,GBIF,Lobo Cabezas 3568,Manuel Vargas,,8.990528,-83.44580500000001,Palmar.  Cordillera Costeña Norte.  Fila Retinto.  Aproximadamente 3.2 Km al NNE en línea recta desde Palmar Norte.  Potrero y remanente de bosque en la ladera sur de la fila.  Finca del Sr. Olivier Pérez y socios.,2015.0,1,1,1,,WGS84,2019,Silvia Lobo|Armando Ruiz Boyer|Javier Solano|G. Alvarado
49137,PRESERVED_SPECIMEN,Sapium allenii,1258445,GBIF,Aguilar Fernández 3077,Manuel Vargas,,8.46,-83.58,Estacion Sirena. Alrededor de Sendero Ollas.,1994.0,1,1,1,,WGS84,2019,Reinaldo Aguilar
49146,PRESERVED_SPECIMEN,Sapium allenii,1258626,GBIF,Aguilar Fernández 4963,Manuel Vargas,,8.46,-83.58,Estacion Sirena. Sendero Espaveles.,1997.0,1,1,1,,WGS84,2019,Reinaldo Aguilar
51204,PRESERVED_SPECIMEN,Sapium allenii,157133,GBIF,Gómez-Laurito 11916,Manuel Vargas,,8.78,-82.96,"Jardín Bot. R. & C. Wilson Coto Brus, San Vito, Las Cruces. Sendero Principal, alrededor de la Estación.",1990.0,1,1,1,,WGS84,2019,Jorge Gómez-Laurito|Quírico Jiménez|Isidro A. Chacón G.|Luis Diego Gómez P.
